symbol,name,exchange,market_cap,sector
JF,J and Friends Holdings Limited American Depositary Shares,NASDAQ,19257162.00,Technology
JFB,JFB Construction Holdings Class A Common Stock,NASDAQ,74813328.00,Consumer Discretionary
JFIN,Jiayin Group Inc. American Depositary Shares,NASDAQ,149662502.00,Finance
JFR,Nuveen Floating Rate Income Fund Common Stock,NYSE,0.00,Finance
JFU,9F Inc. American Depositary Shares,NASDAQ,30139732.00,Finance
JG,Aurora Mobile Limited American Depositary Shares,NASDAQ,26111734.00,Technology
JGH,Nuveen Global High Income Fund Common Shares of Beneficial Interest,NYSE,0.00,Finance
JHI,John Hancock Investors Trust Common Stock,NYSE,116739702.00,Finance
JHS,John Hancock Income Securities Trust Common Stock,NYSE,128345367.00,Finance
JHX,James Hardie Industries plc. Ordinary Shares,NYSE,14977919284.00,Industrials
JILL,J. Jill Inc. Common Stock,NYSE,246548833.00,Consumer Discretionary
JJSF,J & J Snack Foods Corp. Common Stock,NASDAQ,1423759343.00,Consumer Staples
JKHY,Jack Henry & Associates Inc. Common Stock,NASDAQ,10435228059.00,Technology
JKS,JinkoSolar Holding Company Limited American Depositary Shares (each representing 4 Common Shares),NYSE,829543778.00,Technology
JL,J-Long Group Limited Class A Ordinary Shares,NASDAQ,21968334.00,Consumer Discretionary
JLHL,Julong Holding Limited Class A Ordinary Shares,NASDAQ,157218473.00,Consumer Discretionary
JLL,Jones Lang LaSalle Incorporated Common Stock,NYSE,15192040070.00,Finance
JLS,Nuveen Mortgage and Income Fund,NYSE,0.00,Finance
JMIA,Jumia Technologies AG American Depositary Shares each representing two Ordinary Shares,NYSE,873160851.00,Consumer Discretionary
JMM,Nuveen Multi-Market Income Fund (MA),NYSE,0.00,Finance
JMSB,John Marshall Bancorp Inc. Common Stock,NASDAQ,312867984.00,Finance
JNJ,Johnson & Johnson Common Stock,NYSE,633194352052.00,Health Care
JOB,GEE Group Inc. Common Stock,AMEX,23797991.00,Consumer Discretionary
JOBY,Joby Aviation Inc. Common Stock,NYSE,8351127813.00,Industrials
JOE,St. Joe Company (The) Common Stock,NYSE,3520939722.00,Real Estate
JOF,Japan Smaller Capitalization Fund Inc Common Stock,NYSE,0.00,Finance
JOUT,Johnson Outdoors Inc. Class A Common Stock,NASDAQ,455439608.00,Consumer Discretionary
JOYY,JOYY Inc. American Depositary Shares,NASDAQ,3478821182.00,Technology
JPC,Nuveen Preferred & Income Opportunities Fund,NYSE,0.00,Finance
JPM,JP Morgan Chase & Co. Common Stock,NYSE,896216183978.00,Finance
JQC,Nuveen Credit Strategies Income Fund Shares of Beneficial Interest,NYSE,0.00,Finance
JRI,Nuveen Real Asset Income and Growth Fund Common Shares of Beneficial Interest,NYSE,0.00,Finance
JRS,Nuveen Real Estate Income Fund Common Shares of Beneficial Interest,NYSE,0.00,Finance
JRSH,Jerash Holdings (US) Inc. Common Stock,NASDAQ,56514733.00,Consumer Discretionary
JRVR,James River Group Holdings Inc. Common Stock,NASDAQ,206216378.00,Finance
JSM,Navient Corporation 6% Senior Notes due December 15 2043,NASDAQ,1791747305.00,Finance
JSPR,Jasper Therapeutics Inc. Common Stock,NASDAQ,11996598.00,Health Care
JSPRW,Japer Therapeutics Inc. Warrants,NASDAQ,364127.00,Health Care
JTAI,Jet.AI Inc. Common Stock,NASDAQ,11075207.00,Consumer Discretionary
JUNS,Jupiter Neurosciences Inc. Common Stock,NASDAQ,10753977.00,Health Care
JVA,Coffee Holding Co. Inc. Common Stock,NASDAQ,19523409.00,Consumer Staples
JWEL,Jowell Global Ltd. Ordinary Shares,NASDAQ,4871069.00,Consumer Discretionary
JXG,JX Luxventure Group Inc. Common Stock,NASDAQ,130729067.00,Consumer Staples
JXN,Jackson Financial Inc. Class A Common Stock ,NYSE,7286062075.00,Finance
JYD,Jayud Global Logistics Limited Class A Ordinary Shares,NASDAQ,6392643.00,Industrials
JYNT,The Joint Corp. Common Stock,NASDAQ,127870902.00,Miscellaneous
JZ,Jianzhi Education Technology Group Company Limited American Depositary Shs,NASDAQ,7008190.00,Real Estate
JZXN,Jiuzi Holdings Inc. Ordinary Shares,NASDAQ,1488302.00,Consumer Discretionary
KAI,Kadant Inc Common Stock,NYSE,3648814758.00,Industrials
KALA,KALA BIO Inc. Common Stock,NASDAQ,31230842.00,Health Care
KALU,Kaiser Aluminum Corporation Common Stock,NASDAQ,2880358620.00,Industrials
KAPA,Kairos Pharma Ltd. Common Stock,AMEX,7924284.00,Health Care
KARD,Kardigan Inc. Common Stock,NASDAQ,2134824279.00,Health Care
KARO,Karooooo Ltd. Ordinary Shares,NASDAQ,1664222071.00,Technology
KAZR,Skyline Builders Group Holding Limited Class A Ordinary Shares,NASDAQ,381423371.00,Consumer Discretionary
KB,KB Financial Group Inc,NYSE,39211567401.00,Finance
KBDC,Kayne Anderson BDC Inc. Common Stock,NYSE,901696527.00,
KBH,KB Home Common Stock,NYSE,3831566725.00,Consumer Discretionary
KBON,Karbon Capital Partners Corp. Class A Ordinary Shares,NASDAQ,0.00,Finance
KBONU,Karbon Capital Partners Corp. Units,NASDAQ,0.00,Finance
KBONW,Karbon Capital Partners Corp. Warrant,NASDAQ,0.00,Finance
KBR,KBR Inc. Common Stock,NYSE,4616422334.00,Industrials
KBSX,FST Corp. Ordinary Shares,NASDAQ,42532179.00,Consumer Discretionary
KC,Kingsoft Cloud Holdings Limited American Depositary Shares,NASDAQ,2724263942.00,Technology
KCHV,Kochav Defense Acquisition Corp. Class A Ordinary Shares,NASDAQ,0.00,
KCHVR,Kochav Defense Acquisition Corp. Right,NASDAQ,0.00,Finance
KD,Kyndryl Holdings Inc. Common Stock,NYSE,2701335798.00,Technology
KDK,Kodiak AI Inc. Common Stock ,NASDAQ,1060811522.00,Technology
KDKRW,Kodiak AI Inc. Warrants,NASDAQ,151544503.00,Technology
KDP,Keurig Dr Pepper Inc. Common Stock,NASDAQ,45306630384.00,Consumer Staples
KE,Kimball Electronics Inc. Common Stock,NASDAQ,603387528.00,Technology
KEEL,Keel Infrastructure Corp. Common Stock,NASDAQ,2767086719.00,Finance
KELYA,Kelly Services Inc. Class A Common Stock,NASDAQ,453473005.00,Consumer Discretionary
KELYB,Kelly Services Inc. Class B Common Stock,NASDAQ,762722180.00,Consumer Discretionary
KEN,Kenon Holdings Ltd. Ordinary Shares,NYSE,3548581836.00,Utilities
KEP,Korea Electric Power Corporation Common Stock,NYSE,16049101925.00,Utilities
KEQU,Kewaunee Scientific Corporation Common Stock,NASDAQ,105286639.00,Industrials
KEX,Kirby Corporation Common Stock,NYSE,6946440000.00,Consumer Discretionary
KEY,KeyCorp Common Stock,NYSE,24958875338.00,Finance
KEYS,Keysight Technologies Inc. Common Stock,NYSE,53637220200.00,Industrials
KEYY,Keystone Acquisition Corp. Class A Ordinary Shares,NASDAQ,0.00,Finance
KEYYU,Keystone Acquisition Corp. Unit,NASDAQ,0.00,Finance
KEYYW,Keystone Acquisition Corp. Warrants,NASDAQ,0.00,Finance
KF,Korea Fund Inc. (The) New Common Stock,NYSE,0.00,Finance
KFFB,Kentucky First Federal Bancorp Common Stock,NASDAQ,41002071.00,Finance
KFII,K&F Growth Acquisition Corp. II Class A Ordinary shares,NASDAQ,0.00,
KFIIR,K&F Growth Acquisition Corp. II Rights,NASDAQ,0.00,
KFRC,Kforce Inc. Common Stock,NYSE,908183760.00,Consumer Discretionary
KFY,Korn Ferry Common Stock,NYSE,3543715760.00,Consumer Discretionary
KG,Kestrel Group Ltd.,NASDAQ,86153478.00,Finance
KGC,Kinross Gold Corporation Common Stock,NYSE,29506211000.00,Basic Materials
KGEI,Kolibri Global Energy Inc. Common stock,NASDAQ,164793238.00,Energy
KGS,Kodiak Gas Services Inc. Common Stock,NYSE,6029216065.00,Utilities
KHC,The Kraft Heinz Company Common Stock,NASDAQ,30083178676.00,Consumer Staples
KIDS,OrthoPediatrics Corp. Common Stock,NASDAQ,512415630.00,Health Care
KIDZ,KIDZ AI Inc. Class B Common Stock,NASDAQ,1397303.00,Real Estate
KIDZW,KIDZ AI Inc. Warrants,NASDAQ,24662.00,Real Estate
KIM,Kimco Realty Corporation (HC) Common Stock,NYSE,17075549533.00,Real Estate
KINS,Kingstone Companies Inc. Common Stock,NASDAQ,291435001.00,Finance
KIO,KKR Income Opportunities Fund Common Shares,NYSE,0.00,Finance
KITT,Nauticus Robotics Inc. Common stock,NASDAQ,7729397.00,Industrials
KITTW,Nauticus Robotics Inc. Warrant,NASDAQ,174424.00,Industrials
KKR,KKR & Co. Inc. Common Stock,NYSE,84256396783.00,Finance
KKRS,KKR Group Finance Co. IX LLC 4.625% Subordinated Notes due 2061,NYSE,14545541644.00,Finance
KKRT,KKR & Co. Inc. 6.875% Subordinated Notes due 2065,NYSE,0.00,Finance
KLAC,KLA Corporation Common Stock,NASDAQ,307693125716.00,Technology
KLAR,Klarna Group plc Ordinary Shares,NYSE,13915309520.00,Finance
KLC,KinderCare Learning Companies Inc. Common Stock,NYSE,574377250.00,Consumer Discretionary
KLIC,Kulicke and Soffa Industries Inc. Common Stock,NASDAQ,6349547966.00,Technology
KLRA,Kailera Therapeutics Inc. Common Stock,NASDAQ,2849147720.00,Health Care
KLRS,Kalaris Therapeutics Inc. Common Stock,NASDAQ,113013321.00,Health Care
KLTR,Kaltura Inc. Common Stock,NASDAQ,189472175.00,Technology
KLXE,KLX Energy Services Holdings Inc. Common Stock,NASDAQ,48385574.00,Energy
KMB,Kimberly-Clark Corporation Common Stock,NASDAQ,38080197755.00,Consumer Discretionary
KMDA,Kamada Ltd. Ordinary Shares,NASDAQ,432645420.00,Health Care
KMI,Kinder Morgan Inc. Common Stock,NYSE,71327913769.00,Utilities
KMPB,Kemper Corporation 5.875% Fixed-Rate Reset Junior Subordinated Debentures due 2062,NYSE,1401206722.00,Finance
KMPR,Kemper Corporation,NYSE,1697344109.00,Finance
KMRK,K-Tech Solutions Company Limited Class A Ordinary Shares,NASDAQ,20045000.00,Consumer Discretionary
KMT,Kennametal Inc. Common Stock,NYSE,2552276349.00,Industrials
KMTS,Kestra Medical Technologies Ltd. Common Stock,NASDAQ,1574913064.00,Health Care
KMX,CarMax Inc,NYSE,7234627674.00,Consumer Discretionary
KN,Knowles Corporation Common Stock,NYSE,3146921075.00,Consumer Staples
KNDI,Kandi Technologies Group Inc. Ordinary Shares,NASDAQ,72469769.00,Industrials
KNF,Knife Riv Holding Co. Common Stock,NYSE,4817267212.00,Industrials
KNOP,KNOT Offshore Partners LP Common Units representing Limited Partner Interests,NYSE,336266817.00,Consumer Discretionary
KNRX,KNOREX LTD. Class A Ordinary Shares,AMEX,12993712.00,Technology
KNSA,Kiniksa Pharmaceuticals International plc Class A Ordinary Shares,NASDAQ,4964810172.00,Health Care
KNSL,Kinsale Capital Group Inc. Common Stock,NYSE,8183841322.00,Finance
KNTK,Kinetik Holdings Inc. Class A Common Stock,NYSE,7752687040.00,Utilities
KNX,Knight-Swift Transportation Holdings Inc.,NYSE,12406416900.00,Industrials
KO,Coca-Cola Company (The) Common Stock,NYSE,362151423071.00,Consumer Staples
KOD,Kodiak Sciences Inc Common Stock,NASDAQ,2411773116.00,Health Care
KODK,Eastman Kodak Company Common New,NYSE,826672000.00,Consumer Discretionary
KOF,Coca Cola Femsa S.A.B. de C.V.  American Depositary Shares each representing 10 Units (each Unit consists of 3 Series B Shares and 5 Series L Shares),NYSE,5639684256.00,Consumer Staples
KOP,Koppers Holdings Inc. Common Stock,NYSE,888702679.00,Basic Materials
KOPN,Kopin Corporation Common Stock,NASDAQ,713389209.00,Technology
KORE,KORE Group Holdings Inc. Common Stock,NYSE,162335865.00,Telecommunications
KOS,Kosmos Energy Ltd. Common Shares (DE),NYSE,1227901797.00,Energy
KOSS,Koss Corporation Common Stock,NASDAQ,37581759.00,Consumer Staples
KOYN,CSLM Digital Asset Acquisition Corp III Class A Ordinary Shares,NASDAQ,0.00,
KOYNW,CSLM Digital Asset Acquisition Corp III Warrants,NASDAQ,0.00,
KPET,KPET Ultra Paceline Corporation Class A Ordinary Shares,NYSE,0.00,
KPLT,Katapult Holdings Inc. Common Stock,NASDAQ,36262091.00,Consumer Discretionary
KPRX,Kiora Pharmaceuticals Inc.  Common Stock,NASDAQ,11656002.00,Health Care
KPTI,Karyopharm Therapeutics Inc. Common Stock,NASDAQ,217564253.00,Health Care
KR,Kroger Company (The) Common Stock,NYSE,35668324758.00,Consumer Staples
KRAQ,KRAKacquisition Corp Class A Ordinary Shares,NASDAQ,0.00,
KRAQU,KRAKacquisition Corp Unit,NASDAQ,0.00,
KRAQW,KRAKacquisition Corp Warrants,NASDAQ,0.00,
KRC,Kilroy Realty Corporation Common Stock,NYSE,4572082691.00,Real Estate
KREF,KKR Real Estate Finance Trust Inc. Common Stock,NYSE,452031932.00,Real Estate
KRG,Kite Realty Group Trust Common Stock,NYSE,5823948683.00,Real Estate
KRKR,36Kr Holdings Inc. American Depositary Shares,NASDAQ,106190986.00,Consumer Discretionary
KRMD,KORU Medical Systems Inc. Common Stock (DE),NASDAQ,206239170.00,Health Care
KRMN,Karman Holdings Inc. Common Stock,NYSE,7470507475.00,Industrials
KRNT,Kornit Digital Ltd. Ordinary Shares,NASDAQ,723374846.00,Industrials
KRNY,Kearny Financial Corp Common Stock,NASDAQ,606605845.00,Finance
KRO,Kronos Worldwide Inc Common Stock,NYSE,686867103.00,Basic Materials
KROS,Keros Therapeutics Inc. Common Stock,NASDAQ,222856085.00,Health Care
KRP,Kimbell Royalty Partners Common Units Representing Limited Partner Interests,NYSE,1561653809.00,Energy
KRRO,Korro Bio Inc. Common Stock,NASDAQ,201915994.00,Health Care
KRSP,Rice Acquisition Corporation 3 Class A Ordinary Shares,NYSE,0.00,
KRT,Karat Packaging Inc. Common Stock,NASDAQ,683757787.00,Industrials
KRUS,Kura Sushi USA Inc. Class A Common Stock,NASDAQ,699839482.00,Consumer Discretionary
KRYS,Krystal Biotech Inc. Common Stock,NASDAQ,11056972083.00,Health Care
KSCP,Knightscope Inc. Class A Common Stock,NASDAQ,33217143.00,Telecommunications
KSPI,Joint Stock Company Kaspi.kz American Depository Shares,NASDAQ,17005931826.00,
KSS,Kohl's Corporation Common Stock,NYSE,2062745873.00,Consumer Discretionary
KT,KT Corporation Common Stock,NYSE,8529943329.00,Telecommunications
KTB,Kontoor Brands Inc. Common Stock ,NYSE,4698150515.00,Industrials
KTCC,Key Tronic Corporation Common Stock,NASDAQ,46260486.00,Technology
KTF,DWS Municipal Income Trust,NYSE,365778686.00,Finance
KTH,Structures Products Cp 8% CorTS Issued by Peco Energy Cap Tr II Preferred Stock,NYSE,0.00,Finance
KTN,Structured Products Corp 8.205% CorTS 8.205% Corporate Backed Trust Securities (CorTS),NYSE,0.00,Finance
KTOS,Kratos Defense & Security Solutions Inc. Common Stock,NASDAQ,10379231114.00,Industrials
KTTA,Pasithea Therapeutics Corp. Common Stock,NASDAQ,18371264.00,Health Care
KTTAW,Pasithea Therapeutics Corp. Warrant,NASDAQ,330803.00,Health Care
KTWO,K2 Capital Acquisition Corporation Class A Ordinary Share,NASDAQ,199409542.00,
KTWOR,K2 Capital Acquisition Corporation Rights,NASDAQ,4010236.00,
KULR,KULR Technology Group Inc. Common Stock,AMEX,178090085.00,Technology
KURA,Kura Oncology Inc. Common Stock,NASDAQ,985395452.00,Health Care
KUST,Kustom Entertainment Inc. Common Stock,NASDAQ,677009.00,Technology
KVAC,Keen Vision Acquisition Corporation Ordinary Shares,NASDAQ,0.00,
KVACU,Keen Vision Acquisition Corporation Units,NASDAQ,0.00,
KVACW,Keen Vision Acquisition Corporation Warrant,NASDAQ,0.00,
KVHI,KVH Industries Inc. Common Stock,NASDAQ,177234557.00,Technology
KVUE,Kenvue Inc. Common Stock,NYSE,38073771886.00,Consumer Discretionary
KVYO,Klaviyo Inc. Series A Common Stock,NYSE,5057828840.00,Technology
KWM,K Wave Media Ltd. Ordinary Shares,NASDAQ,11001224.00,Consumer Discretionary
KWMWW,K Wave Media Ltd. Warrant,NASDAQ,1149928.00,Consumer Discretionary
KWR,Quaker Houghton Common Stock,NYSE,2798776115.00,Industrials
KWY,Kingsway Corporation Common Stock,NYSE,303939972.00,Finance
KXIN,Kaixin Holdings Ordinary Shares,NASDAQ,80736553.00,Consumer Discretionary
KYIV,Kyivstar Group Ltd. Common Shares,NASDAQ,3619941624.00,Telecommunications
KYIVW,Kyivstar Group Ltd. Warrant,NASDAQ,1362095382.00,Telecommunications
KYMR,Kymera Therapeutics Inc. Common Stock,NASDAQ,9337058814.00,Health Care
KYN,Kayne Anderson Energy Infrastructure Fund Inc.,NYSE,1893589582.00,Finance
KYNB,Kyntra Bio Inc. Common Stock,NASDAQ,30887095.00,Health Care
KYTX,Kyverna Therapeutics Inc. Common Stock,NASDAQ,540469435.00,Health Care
KZIA,Kazia Therapeutics Limited American Depositary Shares,NASDAQ,151406412.00,Health Care
L,Loews Corporation Common Stock,NYSE,23976189082.00,Finance
LAB,Standard BioTools Inc. Common Stock,NASDAQ,356367056.00,Industrials
LABT,Lakewood-Amedex Biotherapeutics Inc. Common Stock,NASDAQ,4814670.00,Health Care
LAC,Lithium Americas Corp. Common Shares,NYSE,1311568487.00,Basic Materials
LAD,Lithia Motors Inc. Common Stock,NYSE,6983826259.00,Consumer Discretionary
LADR,Ladder Capital Corp Class A Common Stock,NYSE,1277957521.00,Real Estate
LAES,SEALSQ Corp Ordinary Shares,NASDAQ,675005217.00,Technology
LAFA,LaFayette Acquisition Corp. Ordinary Share,NASDAQ,0.00,
LAFAR,LaFayette Acquisition Corp. Rights,NASDAQ,0.00,
LAFAU,LaFayette Acquisition Corp. Unit,NASDAQ,0.00,
LAKE,Lakeland Industries Inc. Common Stock,NASDAQ,121982867.00,Health Care
LAMR,Lamar Advertising Company Class A Common Stock,NASDAQ,15988416914.00,Real Estate
LAND,Gladstone Land Corporation Common Stock,NASDAQ,373131356.00,Real Estate
LANDO,Gladstone Land Corporation 6.00% Series B Cumulative Redeemable Preferred Stock,NASDAQ,881064504.00,Real Estate
LANDP,Gladstone Land Corporation 6.00% Series C Cumulative Redeemable Preferred Stock,NASDAQ,870927409.00,Real Estate
LANV,Lanvin Group Holdings Limited Ordinary Shares,NYSE,172066402.00,Consumer Discretionary
LAR,Lithium Argentina AG Common Shares,NYSE,1307124000.00,Basic Materials
LARK,Landmark Bancorp Inc. Common Stock,NASDAQ,189901809.00,Finance
LASE,Laser Photonics Corporation Common Stock,NASDAQ,53647703.00,Miscellaneous
LASR,nLIGHT Inc. Common Stock,NASDAQ,3567850844.00,Technology
LATA,Galata Acquisition Corp. II Class A Ordinary Shares,NASDAQ,0.00,Finance
LATAU,Galata Acquisition Corp. II Units,NASDAQ,0.00,
LATAW,Galata Acquisition Corp. II Warrant,NASDAQ,0.00,Finance
LAUR,Laureate Education Inc. Common Stock,NASDAQ,5347170640.00,Real Estate
LAW,CS Disco Inc. Common Stock,NYSE,248841495.00,Technology
LAZ,Lazard Inc. Common Stock,NYSE,4639488573.00,Finance
LB,LandBridge Company LLC Class A Shares Representing Limited Liability Company Interests,NYSE,5680004045.00,Energy
LBGJ,Li Bang International Corporation Class A Ordinary Shares,NASDAQ,1817599.00,Industrials
LBRDA,Liberty Broadband Corporation Class A Common Stock,NASDAQ,4610582065.00,Telecommunications
LBRDK,Liberty Broadband Corporation Class C Common Stock,NASDAQ,4612017042.00,Telecommunications
LBRDP,Liberty Broadband Corporation Series A Cumulative Redeemable Preferred Stock,NASDAQ,3108160832.00,Telecommunications
LBRT,Liberty Energy Inc. Class A common stock,NYSE,3882323787.00,Energy
LBRX,LB Pharmaceuticals Inc Common Stock,NASDAQ,958660476.00,Health Care
LBTYA,Liberty Global Ltd. Class A Common Shares,NASDAQ,3820490439.00,Telecommunications
LBTYB,Liberty Global Ltd. Class B Common Shares,NASDAQ,4462873787.00,Telecommunications
LBTYK,Liberty Global Ltd. Class C Common Shares,NASDAQ,3685251839.00,Telecommunications
LCCC,Lakeshore Acquisition III Corp. Ordinary Shares,NASDAQ,0.00,Finance
LCCCU,Lakeshore Acquisition III Corp. Unit,NASDAQ,0.00,Finance
LCFY,Locafy Limited Ordinary Share,NASDAQ,5559080.00,Technology
LCFYW,Locafy Limited Warrant,NASDAQ,18980030.00,Technology
LCID,Lucid Group Inc. Common Stock,NASDAQ,2372761393.00,Industrials
LCII,LCI Industries,NYSE,2510118479.00,Consumer Discretionary
LCLN,Lincoln International Inc. Class A Common Stock,NYSE,2510819293.00,Finance
LCNB,LCNB Corporation Common Stock,NASDAQ,254861065.00,Finance
LCTX,Lineage Cell Therapeutics Inc. Common Stock,AMEX,336552698.00,Health Care
LCUT,Lifetime Brands Inc. Common Stock,NASDAQ,195638868.00,Consumer Discretionary
LDI,loanDepot Inc. Class A Common Stock,NYSE,415523396.00,Finance
LDOS,Leidos Holdings Inc. Common Stock,NYSE,13690490119.00,Technology
LDP,Cohen & Steers Limited Duration Preferred and Income Fund Inc.,NYSE,0.00,Finance
LE,Lands' End Inc. Common Stock,NASDAQ,334460633.00,Consumer Discretionary
LEA,Lear Corporation Common Stock,NYSE,6554943704.00,Consumer Discretionary
LECO,Lincoln Electric Holdings Inc. Common Shares,NASDAQ,14158632837.00,Industrials
LEDS,SemiLEDS Corporation Common Stock,NASDAQ,13294821.00,Technology
LEE,Lee Enterprises Incorporated Common Stock,NASDAQ,194067341.00,Consumer Discretionary
LEG,Leggett & Platt Incorporated Common Stock,NYSE,1629003525.00,Consumer Discretionary
LEGH,Legacy Housing Corporation Common Stock (TX),NASDAQ,627358634.00,Consumer Discretionary
LEGN,Legend Biotech Corporation American Depositary Shares,NASDAQ,5555477179.00,Health Care
LEGO,Legato Merger Corp. IV Ordinary Shares,AMEX,301251938.00,Industrials
LEN,Lennar Corporation Class A Common Stock,NYSE,21249360476.00,Consumer Discretionary
LENZ,LENZ Therapeutics Inc. Common Stock,NASDAQ,184677381.00,Health Care
LEO,BNY Mellon Strategic Municipals Inc. Common Stock,NYSE,403021825.00,Finance
LESL,Leslie's Inc. Common Stock,NASDAQ,81052820.00,Consumer Discretionary
LEU,Centrus Energy Corp. Class A Common Stock,NYSE,3189550091.00,Industrials
LEVI,Levi Strauss & Co Class A Common Stock,NYSE,9387994487.00,Consumer Discretionary
LEXX,Lexaria Bioscience Corp. Common Stock,NASDAQ,13883449.00,Health Care
LFAC,Leapfrog Acquisition Corporation Class A Ordinary Shares,NASDAQ,0.00,Finance
LFACW,Leapfrog Acquisition Corporation Warrants,NASDAQ,0.00,Finance
LFCR,Lifecore Biomedical Inc. Common Stock,NASDAQ,190922882.00,Health Care
LFMD,LifeMD Inc. Common Stock,NASDAQ,235525424.00,Health Care
LFMDP,LifeMD Inc. 8.875% Series A Cumulative Perpetual Preferred Stock,NASDAQ,1130231859.00,Health Care
LFS,LEIFRAS Co. Ltd. American Depositary Shares  ,NASDAQ,59646211.00,Consumer Discretionary
LFST,LifeStance Health Group Inc. Common Stock,NASDAQ,4370894049.00,Health Care
LFT,Lument Finance Trust Inc. Common Stock,NYSE,51390674.00,Real Estate
LFTO,Liftoff Mobile Inc. Common Stock,NASDAQ,4217233452.00,Technology
LFUS,Littelfuse Inc. Common Stock,NASDAQ,10582647657.00,Energy
LFVN,Lifevantage Corporation Common Stock (Delaware),NASDAQ,78470413.00,Health Care
LFWD,Lifeward Ltd. Ordinary Shares,NASDAQ,22571560.00,Health Care
LGCL,Lucas GC Limited Ordinary Shares,NASDAQ,70604167.00,Technology
LGCY,Legacy Education Inc. Common Stock,AMEX,147902324.00,Real Estate
LGHL,Lion Group Holding Ltd. American Depositary Share,NASDAQ,1522185.00,Finance
LGI,Lazard Global Total Return and Income Fund Common Stock,NYSE,0.00,
LGIH,LGI Homes Inc. Common Stock,NASDAQ,1441098266.00,Consumer Discretionary
LGL,LGL Group Inc. (The) Common Stock,AMEX,45394515.00,Technology
LGN,Legence Corp. Class A Common stock,NASDAQ,8192516384.00,Consumer Discretionary
LGND,Ligand Pharmaceuticals Incorporated Common Stock,NASDAQ,6404121043.00,Health Care
LGO,Largo Inc. Common Shares,NASDAQ,76197324.00,Industrials
LGPS,LogProstyle Inc. Common Shares,AMEX,18032369.00,Consumer Discretionary
LGVN,Longeveron Inc. Class A Common Stock,NASDAQ,21818386.00,Health Care
LH,Labcorp Holdings Inc. Common Stock,NYSE,23532360000.00,Health Care
LHAI,Linkhome Holdings Inc. Common stock,NASDAQ,28564800.00,Finance
LHSW,Lianhe Sowell International Group Ltd Class A Ordinary Shares,NASDAQ,6187500.00,Technology
LHX,L3Harris Technologies Inc. Common Stock,NYSE,56274115849.00,Industrials
LI,Li Auto Inc. American Depositary Shares,NASDAQ,12840431146.00,Industrials
LICN,Lichen International Limited Class A Ordinary Shares,NASDAQ,20052927.00,Consumer Discretionary
LIDR,AEye Inc. Class A Common Stock,NASDAQ,65303896.00,Consumer Discretionary
LIDRW,AEye Inc. Warrant,NASDAQ,1065241.00,Consumer Discretionary
LIEN,Chicago Atlantic BDC Inc. Common Stock,NASDAQ,227749488.00,Finance
LIF,Life360 Inc. Common Stock,NASDAQ,4676338888.00,Technology
LIFE,Ethos Technologies Inc. Class A Common Stock,NASDAQ,1234057593.00,Finance
LII,Lennox International Inc. Common Stock,NYSE,19837025759.00,Industrials
LILA,Liberty Latin America Ltd. Class A Common Stock,NASDAQ,1688134632.00,Telecommunications
LILAK,Liberty Latin America Ltd. Class C Common Stock,NASDAQ,1690350032.00,Telecommunications
LILAP,Liberty Latin America Ltd. 9.0% Fixed Rate Cumulative Perpetual Redeemable Series A Preference Shares,NASDAQ,4475107556.00,Telecommunications
LIME,Neutron Holdings Inc. Common Stock,NASDAQ,1626735350.00,Technology
LIMN,Liminatus Pharma Inc. Class A Common Stock,NASDAQ,7211588.00,Health Care
LIMNW,Liminatus Pharma Inc. Warrants,NASDAQ,3532413.00,
LIN,Linde plc Ordinary Shares,NASDAQ,252875411999.00,Basic Materials
LINC,Lincoln Educational Services Corporation Common Stock,NASDAQ,1659945696.00,Real Estate
LIND,Lindblad Expeditions Holdings Inc. Common Stock,NASDAQ,1719279958.00,Consumer Discretionary
LINE,Lineage Inc. Common Stock,NASDAQ,10017672060.00,Real Estate
LINK,Interlink Electronics Inc. Common Stock,NASDAQ,67095030.00,Technology
LION,Lionsgate Studios Corp Common Shares,NYSE,4260688723.00,Consumer Discretionary
LIQT,LiqTech International Inc. Common Stock,NASDAQ,7608109.00,Technology
LITB,LightInTheBox Holding Co. Ltd. American Depositary Shares each representing twelve ordinary shares,NYSE,54099547.00,Consumer Discretionary
LITE,Lumentum Holdings Inc. Common Stock,NASDAQ,56663296000.00,Telecommunications
LITS,Lite Strategy Inc. Common Stock,NASDAQ,32337550.00,Health Care
LIVE,Live Ventures Incorporated Common Stock,NASDAQ,30532261.00,Consumer Discretionary
LIVN,LivaNova PLC Ordinary Shares,NASDAQ,4593542448.00,Health Care
LIXT,Lixte Biotechnology Holdings Inc. Common Stock,NASDAQ,108293818.00,Health Care
LKFN,Lakeland Financial Corporation Common Stock,NASDAQ,1554607766.00,Finance
LKFT,Lakefront Biotherapeutics American Depositary Shares,NASDAQ,2002611988.00,Health Care
LKQ,LKQ Corporation Common Stock,NASDAQ,6764696669.00,Consumer Discretionary
LKSP,Lake Superior Acquisition Corp. Class A Ordinary Shares,NASDAQ,0.00,
LKSPR,Lake Superior Acquisition Corp. Rights,NASDAQ,0.00,
LKSPU,Lake Superior Acquisition Corp. Units,NASDAQ,0.00,
LLY,Eli Lilly and Company Common Stock,NYSE,1143189310157.00,Health Care
LLYVA,Liberty Live Holdings Inc. Series A Liberty Live Group Common Stock,NASDAQ,9578581103.00,Consumer Discretionary
LLYVK,Liberty Live Holdings Inc. Series C Liberty Live Group Common Stock,NASDAQ,9936478332.00,Consumer Discretionary
LMAT,LeMaitre Vascular Inc. Common Stock,NASDAQ,2350884028.00,Health Care
LMB,Limbach Holdings Inc. Common Stock,NASDAQ,906001092.00,Consumer Discretionary
LMFA,LM Funding America Inc. Common Stock,NASDAQ,2592431.00,Finance
