symbol,name,exchange,market_cap,sector
PSIX,Power Solutions International Inc. Common Stock,NASDAQ,854710686.00,Industrials
PSKY,Paramount Skydance Corporation Class B Common Stock,NASDAQ,11628208073.00,Industrials
PSMT,PriceSmart Inc. Common Stock,NASDAQ,6114294454.00,Consumer Discretionary
PSN,Parsons Corporation Common Stock,NYSE,6021820947.00,Technology
PSNL,Personalis Inc. Common Stock,NASDAQ,1426301355.00,Health Care
PSNY,Polestar Automotive Holding UK PLC Class A ADS,NASDAQ,2978005759.00,Industrials
PSNYW,Polestar Automotive Holding UK PLC Class C-1 ADS (ADW),NASDAQ,350993820.00,Industrials
PSO,Pearson Plc Common Stock,NYSE,10623765794.00,Consumer Discretionary
PSQH,PSQ Holdings Inc. Class A Common Stock,NYSE,20886481.00,Consumer Discretionary
PSTL,Postal Realty Trust Inc. Class A Common Stock,NYSE,685071678.00,Real Estate
PSTV,PLUS THERAPEUTICS Inc. Common Stock ,NASDAQ,27394762.00,Health Care
PSUS,Pershing Square USA Ltd. Common Shares,NYSE,991085000.00,
PSX,Phillips 66 Common Stock,NYSE,70732956228.00,Energy
PTA,Cohen & Steers Tax-Advantaged Preferred Securities and Income Fund Common Shares of Beneficial Interest,NYSE,1067883189.00,Finance
PTACU,Patriot Acquisition Corp. Units,NASDAQ,0.00,
PTC,PTC Inc. Common Stock,NASDAQ,14386246269.00,Technology
PTCT,PTC Therapeutics Inc. Common Stock,NASDAQ,6910509349.00,Health Care
PTEN,Patterson-UTI Energy Inc. Common Stock,NASDAQ,3287488875.00,Energy
PTGX,Protagonist Therapeutics Inc. Common Stock,NASDAQ,8464662914.00,Health Care
PTHS,Pelthos Therapeutics Inc. Common Stock,AMEX,89567372.00,Health Care
PTLE,PTL LTD Class A Ordinary Shares,NASDAQ,45224078.00,Energy
PTLO,Portillo's Inc. Class A Common Stock,NASDAQ,377511410.00,Consumer Discretionary
PTN,Palatin Technologies Inc. Common Stock,NASDAQ,20621797.00,Health Care
PTON,Peloton Interactive Inc. Class A Common Stock,NASDAQ,2489703569.00,Consumer Discretionary
PTOR,Praetorian Acquisition Corp. Class A Ordinary Shares,NASDAQ,0.00,Finance
PTORW,Praetorian Acquisition Corp. Warrant,NASDAQ,0.00,Finance
PTRN,Pattern Group Inc. Series A Common Stock,NASDAQ,4674570627.00,Consumer Discretionary
PTY,Pimco Corporate & Income Opportunity Fund,NYSE,0.00,Finance
PUBM,PubMatic Inc. Class A Common Stock,NASDAQ,629307054.00,Technology
PUK,Prudential Public Limited Company Common Stock,NYSE,35211192896.00,Finance
PULM,Pulmatrix Inc. Common Stock,NASDAQ,6281930.00,Health Care
PUMP,ProPetro Holding Corp. Common Stock,NYSE,1482439240.00,Energy
PURR,Hyperliquid Strategies Inc Common Stock,NASDAQ,1582252093.00,Finance
PUSA,Aureus Greenway Holdings Inc. Common Stock,NASDAQ,83178026.00,Consumer Discretionary
PVH,PVH Corp. Common Stock,NYSE,3468711761.00,Industrials
PVL,Permianville Royalty Trust Units of Beneficial Interest,NYSE,54450000.00,Energy
PVLA,Palvella Therapeutics Inc. Common Stock,NASDAQ,2104955785.00,Health Care
PW,Power REIT (MD) Common Stock,AMEX,3483148.00,Real Estate
PWP,Perella Weinberg Partners Class A Common Stock,NASDAQ,1530630770.00,Finance
PWR,Quanta Services Inc. Common Stock,NYSE,100286698178.00,Industrials
PWRL,Powerlaw Corp. Common Stock,NASDAQ,0.00,
PXED,Phoenix Education Partners Inc. Common Stock,NYSE,1230465170.00,Real Estate
PXLW,Pixelworks Inc.  Common Stock,NASDAQ,38656792.00,Technology
PXS,Pyxis Tankers Inc. Common Stock,NASDAQ,43155584.00,Consumer Discretionary
PYPD,PolyPid Ltd. Ordinary Shares,NASDAQ,95797845.00,Health Care
PYPL,PayPal Holdings Inc. Common Stock,NASDAQ,40109336767.00,Industrials
PYT,PPlus Tr GSC-2 Tr Ctf Fltg Rate,NYSE,0.00,Finance
PYXS,Pyxis Oncology Inc. Common Stock,NASDAQ,166624918.00,Health Care
PZG,Paramount Gold Nevada Corp. Common Stock,AMEX,102941257.00,Basic Materials
PZZA,Papa John's International Inc. Common Stock,NASDAQ,1178550141.00,Consumer Discretionary
Q,Qnity Electronics Inc. Common Stock,NYSE,29673832592.00,Technology
QADR,QDRO Acquisition Corp. Class A Ordinary Shares,NASDAQ,0.00,Finance
QADRW,QDRO Acquisition Corp. Warrant,NASDAQ,0.00,Finance
QBTS,D-Wave Quantum Inc. Common Shares,NYSE,8262598151.00,Technology
QCLS,Q/C Technologies Inc. Common Stock,NASDAQ,30235702.00,Health Care
QCOM,QUALCOMM Incorporated Common Stock,NASDAQ,185767500000.00,Technology
QCRH,QCR Holdings Inc. Common Stock,NASDAQ,1595671107.00,Finance
QDEL,QuidelOrtho Corporation Common Stock,NASDAQ,1244485549.00,Health Care
QETA,Quetta Acquisition Corporation Common Stock,NASDAQ,0.00,Finance
QETAR,Quetta Acquisition Corporation Right,NASDAQ,0.00,Finance
QFIN,Qfin Holdings Inc. American Depositary Shares,NASDAQ,1882284127.00,Finance
QGEN,Qiagen N.V. Common Shares,NYSE,8263597595.00,Health Care
QH,Quhuo Limited American Depository Shares,NASDAQ,642809445.00,
QLEP,Quantum Leap Acquisition Corp Class A Ordinary Shares,NYSE,0.00,
QLYS,Qualys Inc. Common Stock,NASDAQ,5227147246.00,Technology
QMCO,Quantum Corporation Common Stock,NASDAQ,400044920.00,Technology
QNC,Quantum eMotion Corp. Common Shares,AMEX,653721617.00,
QNCX,Quince Therapeutics Inc. Common Stock,NASDAQ,16850302.00,Health Care
QNRX,Quoin Pharmaceuticals Ltd. American Depositary Shares,NASDAQ,9198550.00,Health Care
QNST,QuinStreet Inc. Common Stock,NASDAQ,908785753.00,Consumer Discretionary
QNT,Quantinuum Inc. Class A Common Stock,NASDAQ,19457978151.00,Technology
QNTM,Quantum Biopharma Ltd. Class B Subordinate Voting Shares,NASDAQ,22459104.00,Health Care
QQQX,Nuveen NASDAQ 100 Dynamic Overwrite Fund Shares of Beneficial Interest,NASDAQ,0.00,Finance
QRED,QuasarEdge Acquisition Corporation Ordinary Shares,NYSE,0.00,Finance
QRHC,Quest Resource Holding Corporation Common Stock,NASDAQ,27184832.00,Utilities
QRVO,Qorvo Inc. Common Stock,NASDAQ,7725051213.00,Technology
QS,QuantumScape Corporation Class A Common Stock,NASDAQ,4349075687.00,Miscellaneous
QSEA,Quartzsea Acquisition Corporation Ordinary Shares,NASDAQ,0.00,Finance
QSEAR,Quartzsea Acquisition Corporation Rights,NASDAQ,0.00,Finance
QSEAU,Quartzsea Acquisition Corporation Units,NASDAQ,0.00,Finance
QSI,Quantum-Si Incorporated Class A Common Stock,NASDAQ,202604056.00,Industrials
QSR,Restaurant Brands International Inc. Common Shares,NYSE,34129436302.00,Consumer Discretionary
QTEX,QTREX Quantum Ltd. Ordinary Shares,NASDAQ,70283117.00,Health Care
QTEXW,QTREX Quantum Ltd. Warrant,NASDAQ,1454811.00,Health Care
QTI,QT Imaging Holdings Inc. Common Stock,NASDAQ,55764057.00,Health Care
QTRX,Quanterix Corporation Common Stock,NASDAQ,203968898.00,Industrials
QTTB,Q32 Bio Inc. Common Stock,NASDAQ,221959472.00,Health Care
QTWO,Q2 Holdings Inc. Common Stock,NYSE,3294660262.00,Technology
QUAD,Quad Graphics Inc Class A Common Stock,NYSE,431553208.00,Consumer Discretionary
QUBT,Quantum Computing Inc. Common Stock,NASDAQ,2041091632.00,Technology
QUCY,Quantum Cyber N.V. Ordinary Shares,NASDAQ,33012518.00,Health Care
QUIK,QuickLogic Corporation Common Stock,NASDAQ,291961392.00,Technology
QUMS,Quantumsphere Acquisition Corp. Ordinary Shares,NASDAQ,0.00,
QUMSR,Quantumsphere Acquisition Corp. Rights,NASDAQ,0.00,
QUMSU,Quantumsphere Acquisition Corp. Units,NASDAQ,0.00,
QURE,uniQure N.V. Ordinary Shares,NASDAQ,2636851548.00,Health Care
QXL,Quantum X Labs Inc. Common Stock,NASDAQ,75617343.00,Technology
QXO,QXO Inc. Common Stock,NYSE,11757199642.00,Consumer Discretionary
R,Ryder System Inc. Common Stock,NYSE,10087522213.00,Consumer Discretionary
RA,Brookfield Real Assets Income Fund Inc. Common Stock,NYSE,0.00,Finance
RAC,Rithm Acquisition Corp. Class A Ordinary Shares,NYSE,0.00,
RACC,Research Alliance Corporation III Class A Ordinary Shares,NASDAQ,0.00,
RACE,Ferrari N.V. Common Shares,NYSE,90061627254.00,Industrials
RADX,Radiopharm Theranostics Limited American Depositary Shares,NASDAQ,55735216.00,Health Care
RAIL,FreightCar America Inc. Common Stock,NASDAQ,171660756.00,Industrials
RAIN,Rain Enhancement Technologies Holdco Inc. Class A Common Stock,NASDAQ,20208029.00,Technology
RAINW,Rain Enhancement Technologies Holdco Inc. Warrants,NASDAQ,1901509.00,Technology
RAL,Ralliant Corporation Common Stock,NYSE,7651749997.00,Industrials
RAMP,LiveRamp Holdings Inc. Common Stock,NYSE,2267115184.00,Technology
RAND,Rand Capital Corporation Common Stock,NASDAQ,30648480.00,Finance
RANG,Range Capital Acquisition Corp. Ordinary Shares,NASDAQ,0.00,Finance
RANGR,Range Capital Acquisition Corp. Rights,NASDAQ,0.00,Finance
RANI,Rani Therapeutics Holdings Inc. Class A Common Stock,NASDAQ,95550861.00,Health Care
RAPP,Rapport Therapeutics Inc. Common Stock,NASDAQ,1863815423.00,Health Care
RARE,Ultragenyx Pharmaceutical Inc. Common Stock,NASDAQ,3296434327.00,Health Care
RAVE,Rave Restaurant Group Inc. Common Stock,NASDAQ,48461440.00,Consumer Discretionary
RAY,Raytech Holding Limited Ordinary Shares,NASDAQ,8037851.00,Consumer Discretionary
RAYA,Erayak Power Solution Group Inc. Class A Ordinary Shares,NASDAQ,2741368.00,Consumer Discretionary
RBA,RB Global Inc. Common Stock,NYSE,20973531979.00,Consumer Discretionary
RBB,RBB Bancorp Common Stock,NASDAQ,459470641.00,Finance
RBBN,Ribbon Communications Inc. Common Stock,NASDAQ,376937603.00,Technology
RBC,RBC Bearings Incorporated Common Stock,NYSE,19125472637.00,Industrials
RBCAA,Republic Bancorp Inc. Class A Common Stock,NASDAQ,1795022295.00,Finance
RBKB,Rhinebeck Bancorp Inc. Common Stock,NASDAQ,192347073.00,Finance
RBLX,Roblox Corporation Class A Common Stock,NYSE,39672382260.00,Technology
RBNE,Robin Energy Ltd. Common Stock,NASDAQ,1861934.00,Consumer Discretionary
RBRK,Rubrik Inc. Class A Common Stock,NYSE,17215501260.00,Technology
RC,Ready Capital Corporation Common Stock,NYSE,295786887.00,Real Estate
RCAT,Red Cat Holdings Inc. Common Stock,NASDAQ,1281430249.00,Technology
RCD,Ready Capital Corporation 9.00% Senior Notes due 2029,NYSE,0.00,Real Estate
RCEL,Avita Medical Inc. Common Stock,NASDAQ,155730046.00,Health Care
RCG,RENN Fund Inc Common Stock,AMEX,0.00,Finance
RCI,Rogers Communication Inc. Common Stock,NYSE,17081891670.00,Telecommunications
RCKT,Rocket Pharmaceuticals Inc. Common Stock,NASDAQ,419303228.00,Health Care
RCKTW,Rocket Pharmaceuticals Inc. Warrant,NASDAQ,327581.00,Health Care
RCKY,Rocky Brands Inc. Common Stock,NASDAQ,303615274.00,Consumer Discretionary
RCL,Royal Caribbean Cruises Ltd. Common Stock,NYSE,79466171981.00,Consumer Discretionary
RCMT,RCM Technologies Inc. Common Stock,NASDAQ,201996999.00,Consumer Discretionary
RCON,Recon Technology Ltd. Class A Ordinary Shares,NASDAQ,12863519.00,Energy
RCS,PIMCO Strategic Income Fund Inc.,NYSE,0.00,Finance
RCT,RedCloud Holdings plc Ordinary Shares,NASDAQ,14187524.00,Technology
RCUS,Arcus Biosciences Inc. Common Stock,NYSE,3814700003.00,Health Care
RDAC,Rising Dragon Acquisition Corp. Ordinary Shares,NASDAQ,0.00,
RDACR,Rising Dragon Acquisition Corp. Rights,NASDAQ,0.00,Finance
RDAG,Republic Digital Acquisition Company Class A Ordinary Shares,NASDAQ,0.00,Finance
RDAGW,Republic Digital Acquisition Company Warrants,NASDAQ,0.00,Finance
RDCM,Radcom Ltd. Ordinary Shares,NASDAQ,243013054.00,Technology
RDDT,Reddit Inc. Class A Common Stock,NYSE,37461350456.00,Technology
RDGT,Ridgetech Inc. Ordinary Shares,NASDAQ,1375326.00,Consumer Staples
RDHL,Redhill Biopharma Ltd. American Depositary Shares,NASDAQ,4938923.00,Health Care
RDI,Reading International Inc Class A Common Stock,NASDAQ,28737334.00,Consumer Discretionary
RDIB,Reading International Inc Class B Common Stock,NASDAQ,193323883.00,Consumer Discretionary
RDN,Radian Group Inc. Common Stock,NYSE,5045078936.00,Finance
RDNT,RadNet Inc. Common Stock,NASDAQ,5406103725.00,Health Care
RDNW,RideNow Group Inc. Class B Common Stock,NASDAQ,246957926.00,Technology
RDVT,Red Violet Inc. Common Stock ,NASDAQ,924416504.00,Technology
RDW,Redwire Corporation Common Stock,NYSE,2701114652.00,Industrials
RDWR,Radware Ltd. Ordinary Shares,NASDAQ,1256093939.00,Consumer Discretionary
RDY,Dr. Reddy's Laboratories Ltd Common Stock,NYSE,12002367229.00,Health Care
RDZN,Roadzen Inc. Ordinary Shares,NASDAQ,113313888.00,Finance
RDZNW,Roadzen Inc. Warrants,NASDAQ,16066895.00,Finance
REA,Rare Earths Americas Inc. Common Stock,AMEX,278901021.00,Basic Materials
REAL,The RealReal Inc. Common Stock,NASDAQ,1395247890.00,Consumer Discretionary
REAX,The Real Brokerage Inc. Common Shares,NASDAQ,463291092.00,Finance
REBN,Reborn Coffee Inc. Common Stock,NASDAQ,13059393.00,Consumer Discretionary
RECT,Rectitude Holdings Ltd Ordinary Shares,NASDAQ,19132587.00,Consumer Discretionary
REE,REE Automotive Ltd. Class A Ordinary Shares,NASDAQ,6693681.00,Industrials
REED,Reed's Inc. Common Stock,AMEX,15769924.00,Consumer Staples
REFI,Chicago Atlantic Real Estate Finance Inc. Common Stock,NASDAQ,226493195.00,Real Estate
REFR,Research Frontiers Incorporated Common Stock,NASDAQ,19090113.00,Miscellaneous
REG,Regency Centers Corporation Common Stock,NASDAQ,14823516118.00,Real Estate
REGCO,Regency Centers Corporation 5.875% Series B Cumulative Redeemable Preferred Stock,NASDAQ,4028129380.00,Real Estate
REGCP,Regency Centers Corporation 6.25% Series A Cumulative Redeemable Preferred Stock,NASDAQ,4241656856.00,Real Estate
REGN,Regeneron Pharmaceuticals Inc. Common Stock,NASDAQ,68593033467.00,Health Care
REI,Ring Energy Inc. Common Stock,AMEX,224067823.00,Energy
REKR,Rekor Systems Inc. Common Stock,NASDAQ,93903778.00,Telecommunications
RELL,Richardson Electronics Ltd. Common Stock,NASDAQ,241790474.00,Technology
RELX,RELX PLC PLC American Depositary Shares (Each representing One Ordinary Share),NYSE,58239601415.00,Consumer Discretionary
RELY,Remitly Global Inc. Common Stock,NASDAQ,5000825626.00,Consumer Discretionary
RENT,Rent the Runway Inc. Class A Common Stock,NASDAQ,115873180.00,Consumer Discretionary
RENX,RenX Enterprises Corp. Common Stock,NASDAQ,5227754.00,Finance
REPL,Replimune Group Inc. Common Stock,NASDAQ,972084964.00,Health Care
REPX,Riley Exploration Permian Inc. Common Stock,AMEX,705335237.00,Energy
RERE,ATRenew Inc. American Depositary Shares (every three of which representing two Class A ordinary shares),NYSE,870482034.00,Consumer Discretionary
RES,RPC Inc. Common Stock,NYSE,1241172436.00,Energy
RETO,ReTo Eco-Solutions Inc. Class A Shares,NASDAQ,90797226.00,Industrials
REVB,Revelation Biosciences Inc. Common Stock,NASDAQ,4221094.00,Health Care
REVBW,Revelation Biosciences Inc. Warrant,NASDAQ,25405.00,Health Care
REX,REX American Resources Corporation,NYSE,1481538556.00,Industrials
REXR,Rexford Industrial Realty Inc. Common Stock,NYSE,7721816851.00,Real Estate
REYN,Reynolds Consumer Products Inc. Common Stock,NASDAQ,5728657307.00,Consumer Discretionary
REZI,Resideo Technologies Inc. Common Stock ,NYSE,4642729132.00,Industrials
RF,Regions Financial Corporation Common Stock,NYSE,25840332411.00,Finance
RFAI,RF Acquisition Corp II Ordinary Shares,NASDAQ,0.00,
RFAIR,RF Acquisition Corp II Right,NASDAQ,0.00,Technology
RFAIU,RF Acquisition Corp II Unit,NASDAQ,0.00,Technology
RFAM,RF Acquisition Corp III Ordinary Shares,NASDAQ,0.00,
RFI,Cohen & Steers Total Return Realty Fund Inc. Common Stock,NYSE,564111449.00,Finance
RFIL,RF Industries Ltd. Common Stock,NASDAQ,193261030.00,Technology
RFL,Rafael Holdings Inc. Class B Common Stock,NYSE,163799987.00,Finance
RFM,RiverNorth Flexible Municipal Income Fund Inc. Common Stock,NYSE,90864427.00,Finance
RFMZ,RiverNorth Flexible Municipal Income Fund II Inc. Common Stock,NYSE,332644987.00,Finance
RGA,Reinsurance Group of America Incorporated Common Stock,NYSE,14478409023.00,Finance
RGC,Regencell Bioscience Holdings Limited Ordinary Shares,NASDAQ,3149894344.00,Health Care
RGCO,RGC Resources Inc. Common Stock,NASDAQ,250396173.00,Utilities
RGEN,Repligen Corporation Common Stock,NASDAQ,8032462176.00,Health Care
RGLD,Royal Gold Inc. Common Stock,NASDAQ,17323819466.00,Industrials
RGNT,Regentis Biomaterials Ltd. Ordinary Shares,AMEX,20872893.00,Health Care
RGNX,REGENXBIO Inc. Common Stock,NASDAQ,686544407.00,Health Care
RGP,Resources Connection Inc. Common Stock,NASDAQ,158601569.00,Consumer Discretionary
RGR,Sturm Ruger & Company Inc. Common Stock,NYSE,600301125.00,Industrials
RGS,Regis Corporation Common Stock,NASDAQ,67716884.00,Consumer Discretionary
RGT,Royce Global Trust Inc. Common Stock,NYSE,90306649.00,Finance
RGTI,Rigetti Computing Inc. Common Stock,NASDAQ,5963234598.00,Technology
RGTIW,Rigetti Computing Inc. Warrants,NASDAQ,2660852450.00,Technology
RH,RH Common Stock,NYSE,3195775839.00,Consumer Discretionary
RHI,Robert Half Inc. Common Stock,NYSE,3424789360.00,Consumer Discretionary
RHLD,Resolute Holdings Management Common Stock ,NYSE,1224908946.00,Finance
RHP,Ryman Hospitality Properties Inc. (REIT),NYSE,8068520425.00,Real Estate
RIBB,Ribbon Acquisition Corp Class A Ordinary Shares,NASDAQ,0.00,
RIBBR,Ribbon Acquisition Corp Rights,NASDAQ,0.00,
RIBBU,Ribbon Acquisition Corp Unit,NASDAQ,0.00,
RICK,RCI Hospitality Holdings Inc. Common Stock,NASDAQ,209765080.00,Consumer Discretionary
RIG,Transocean Ltd (Switzerland) Common Stock,NYSE,6598288986.00,Energy
RIGL,Rigel Pharmaceuticals Inc. Common Stock,NASDAQ,716400538.00,Health Care
RILY,BRC Group Holdings Inc. Common Stock,NASDAQ,320753674.00,Finance
RILYG,BRC Group Holdings Inc. 5.00% Senior Notes due 2026,NASDAQ,745043322.00,Finance
RILYL,BRC Group Holdings Inc. Depositary Shares each representing 1/1000th in a share of 7.375% Series B Cumulative Perpetual Preferred Stock par value $0.0001,NASDAQ,573180384.00,Finance
RILYN,BRC Group Holdings Inc. 6.50% Senior Notes Due 2026,NASDAQ,761511738.00,Finance
RILYP,BRC Group Holdings Inc. Depositary Shares each representing a 1/1000th fractional interest in a share of Series A Cumulative Perpetual Preferred Stock,NASDAQ,568353001.00,Finance
RILYT,BRC Group Holdings Inc. 6.00% Senior Notes Due 2028,NASDAQ,619090440.00,Finance
RILYZ,BRC Group Holdings Inc. 5.25% Senior Notes due 2028,NASDAQ,557028910.00,Finance
RIME,Algorhythm Holdings Inc. Common Stock,NASDAQ,8997961.00,Consumer Staples
RIO,Rio Tinto Plc Common Stock,NYSE,118592493848.00,Basic Materials
RIOT,Riot Platforms Inc. Common Stock ,NASDAQ,8353472117.00,Finance
RITM,Rithm Capital Corp. Common Stock,NYSE,5075006967.00,Real Estate
RITR,Reitar Logtech Holdings Limited Ordinary shares,NASDAQ,26064021.00,Finance
RIV,RiverNorth Opportunities Fund Inc. Common Stock,NYSE,0.00,Finance
RIVN,Rivian Automotive Inc. Class A Common Stock,NASDAQ,23481583502.00,Industrials
RJET,Republic Airways Holdings Inc. Common Stock,NASDAQ,1001682492.00,Consumer Discretionary
RJF,Raymond James Financial Inc. Common Stock,NYSE,31699674310.00,Finance
RKDA,Arcadia Biosciences Inc. Common Stock,NASDAQ,1599197.00,Consumer Staples
RKLB,Rocket Lab Corporation Common Stock,NASDAQ,58153026539.00,Industrials
RKT,Rocket Companies Inc. Class A Common Stock,NYSE,44620106716.00,Finance
RKTO,Rocket One Inc. Common Stock,NASDAQ,19822225.00,Health Care
RL,Ralph Lauren Corporation Common Stock,NYSE,23700599304.00,Industrials
RLAY,Relay Therapeutics Inc. Common Stock,NASDAQ,3573081977.00,Health Care
RLGT,Radiant Logistics Inc. Common Stock,AMEX,444432510.00,Industrials
RLI,RLI Corp. Common Stock (DE),NYSE,5747984454.00,Finance
RLJ,RLJ Lodging Trust Common Shares of Beneficial Interest $0.01 par value,NYSE,1789732172.00,Real Estate
RLMD,Relmada Therapeutics Inc. Common Stock,NASDAQ,658710600.00,Health Care
RLTY,Cohen & Steers Real Estate Opportunities and Income Fund Common Shares of Beneficial Interest,NYSE,0.00,Finance
RLX,RLX Technology Inc. American Depositary Shares each representing the right to receive one (1) Class A ordinary share,NYSE,2989454793.00,Health Care
RLYB,Rallybio Corporation Common Stock,NASDAQ,83790037.00,Health Care
RM,Regional Management Corp. Common Stock,NYSE,383611321.00,Finance
RMAX,RE/MAX Holdings Inc. Class A Common Stock,NYSE,236108914.00,Finance
RMBI,Richmond Mutual Bancorporation Inc. Common Stock,NASDAQ,159199102.00,Finance
RMBS,Rambus Inc. Common Stock,NASDAQ,12210826314.00,Technology
RMCF,Rocky Mountain Chocolate Factory Inc. Common Stock,NASDAQ,10289152.00,Consumer Staples
RMCO,Royalty Management Holding Corporation Class A Common Stock,NASDAQ,40172826.00,Miscellaneous
RMCOW,Royalty Management Holding Corporation Warrant,NASDAQ,2619571.00,Miscellaneous
RMD,ResMed Inc. Common Stock,NYSE,30408169778.00,Health Care
RMI,RiverNorth Opportunistic Municipal Income Fund Inc. Common Stock,NYSE,99741644.00,Finance
RMIX,Suncrete Inc. Class A Common Stock,NASDAQ,1553039832.00,Industrials
RMM,RiverNorth Managed Duration Municipal Income Fund Inc. Common Stock,NYSE,293528268.00,Finance
RMMZ,RiverNorth Managed Duration Municipal Income Fund II Inc. Common Stock,NYSE,296884005.00,Finance
RMNI,Rimini Street Inc. (DE) Common Stock,NASDAQ,420222400.00,Consumer Discretionary
RMR,The RMR Group Inc. Class A Common Stock,NASDAQ,637414311.00,Consumer Discretionary
RMSG,Real Messenger Corporation Ordinary Shares,NASDAQ,4267086.00,Technology
RMSGW,Real Messenger Corporation Warrants,NASDAQ,270574.00,Technology
RMT,Royce Micro-Cap Trust Inc. Common Stock,NYSE,665349759.00,Finance
RMTI,Rockwell Medical Inc. Common Stock,NASDAQ,21866546.00,Health Care
RNA,Atrium Therapeutics Inc. Common Stock,NASDAQ,233492027.00,Health Care
RNAC,Cartesian Therapeutics Inc. Common Stock,NASDAQ,311150233.00,Health Care
RNAZ,TransCode Therapeutics Inc. Common Stock,NASDAQ,8182100.00,Health Care
RNG,RingCentral Inc. Class A Common Stock,NYSE,3355182746.00,Technology
RNGR,Ranger Energy Services Inc. Class A Common Stock,NYSE,366404227.00,Energy
RNGT,Range Capital Acquisition Corp II Class A Ordinary Shares,NASDAQ,0.00,Finance
RNGTW,Range Capital Acquisition Corp II Warrants,NASDAQ,0.00,Finance
RNP,Cohen & Steers REIT and Preferred and Income Fund Inc. Common Shares,NYSE,1014712668.00,Finance
RNR,RenaissanceRe Holdings Ltd. Common Stock,NYSE,13910734948.00,Finance
RNST,Renasant Corporation Common Stock,NYSE,3965855718.00,Finance
RNTX,Rein Therapeutics Inc. Common Stock,NASDAQ,84811950.00,Health Care
RNW,ReNew Energy Global plc Class A Ordinary Shares,NASDAQ,2209264087.00,Utilities
RNWWW,ReNew Energy Global plc Warrant,NASDAQ,1305969.00,Utilities
RNXT,RenovoRx Inc. Common Stock,NASDAQ,41495712.00,Health Care
ROAD,Construction Partners Inc. Class A Common Stock,NASDAQ,6101229357.00,Industrials
ROC,Rank One Computing Corporation Common stock,NASDAQ,95400635.00,Technology
ROCK,Gibraltar Industries Inc. Common Stock,NASDAQ,1302751482.00,Industrials
ROG,Rogers Corporation Common Stock,NYSE,2568404187.00,Industrials
ROIV,Roivant Sciences Ltd. Common Shares,NASDAQ,25267968625.00,Health Care
ROK,Rockwell Automation Inc. Common Stock,NYSE,52487923630.00,Industrials
ROKU,Roku Inc. Class A Common Stock,NASDAQ,21020330012.00,Telecommunications
ROL,Rollins Inc. Common Stock,NYSE,20885893701.00,Consumer Discretionary
ROLR,High Roller Technologies Inc. Common Stock,AMEX,65923612.00,Consumer Discretionary
ROMA,Roma Green Finance Limited Class A Ordinary Shares,NASDAQ,479494797.00,Consumer Discretionary
ROOT,Root Inc. Class A Common Stock,NASDAQ,976957252.00,Finance
ROP,Roper Technologies Inc. Common Stock,NASDAQ,36754102148.00,Technology
ROST,Ross Stores Inc. Common Stock,NASDAQ,68464305051.00,Consumer Discretionary
RPAY,Repay Holdings Corporation Class A Common Stock,NASDAQ,380213851.00,Consumer Discretionary
RPC,Ridgepost Capital Inc. Class A Common Stock,NYSE,857201684.00,Finance
RPD,Rapid7 Inc. Common Stock,NASDAQ,620856441.00,Technology
RPGL,Republic Power Group Limited Class A Ordinary Shares,NASDAQ,2025489.00,Technology
RPID,Rapid Micro Biosystems Inc. Class A Common Stock,NASDAQ,79411027.00,Industrials
RPM,RPM International Inc. Common Stock,NYSE,14245672944.00,Consumer Discretionary
RPRX,Royalty Pharma plc Class A Ordinary Shares ,NASDAQ,33265826425.00,Health Care
RPT,Rithm Property Trust Inc. Common stock,NYSE,114256691.00,Real Estate
RQI,Cohen & Steers Quality Income Realty Fund Inc Common Shares,NYSE,1678755100.00,Finance
RR,Richtech Robotics Inc. Class B Common Stock,NASDAQ,438248107.00,Industrials
RRBI,Red River Bancshares Inc. Common Stock,NASDAQ,624163334.00,Consumer Discretionary
RRC,Range Resources Corporation Common Stock,NYSE,8908877273.00,Energy
RREV,RRE Ventures Acquisition Corp. Class A Ordinary Shares,NASDAQ,0.00,Finance
RREVU,RRE Ventures Acquisition Corp. Units,NASDAQ,0.00,Finance
RREVW,RRE Ventures Acquisition Corp. Warrants,NASDAQ,0.00,Finance
RRGB,Red Robin Gourmet Burgers Inc. Common Stock,NASDAQ,132272505.00,Consumer Discretionary
RRR,Red Rock Resorts Inc. Class A Common Stock,NASDAQ,6845454333.00,Consumer Discretionary
RRX,Regal Rexnord Corporation Common Stock,NYSE,14542123222.00,Consumer Discretionary
RS,Reliance Inc. Common Stock,NYSE,18990560669.00,Industrials
RSF,RiverNorth Capital and Income Fund Common Stock,NYSE,48853856.00,Finance
RSG,Republic Services Inc. Common Stock,NYSE,66867712669.00,Utilities
RSI,Rush Street Interactive Inc. Class A Common Stock,NYSE,7372826145.00,Consumer Discretionary
RSKD,Riskified Ltd. Class A Ordinary Shares,NYSE,760292245.00,Consumer Discretionary
RSSS,Research Solutions Inc Common Stock,NASDAQ,76011650.00,Technology
RSVR,Reservoir Media Inc. Common Stock,NASDAQ,669749483.00,Consumer Discretionary
RTAC,Renatus Tactical Acquisition Corp I Class A Ordinary Shares,NASDAQ,0.00,Finance
RTACU,Renatus Tactical Acquisition Corp I Unit,NASDAQ,0.00,Finance
RTACW,Renatus Tactical Acquisition Corp I Warrant,NASDAQ,0.00,Finance
RTB,RTB Digital Inc. Common Stock,NASDAQ,18952528.00,Consumer Discretionary
RTO,Rentokil Initial plc American Depositary Shares (each representing five (5) Ordinary Shares),NYSE,7563478000.00,Consumer Discretionary
RTX,RTX Corporation Common Stock,NYSE,268326673029.00,Industrials
RUBI,Rubico Inc. Common Stock,NASDAQ,3085704.00,Consumer Discretionary
RUM,RUM Group Inc. Class A Common Stock,NASDAQ,2685012108.00,Technology
RUMBW,RUM Group Inc. Warrant,NASDAQ,788940246.00,Technology
