symbol,name,exchange,market_cap,sector
CVS,CVS Health Corporation Common Stock,NYSE,133615107589.00,Consumer Staples
CVSA,Covista Inc. Common Shares,NYSE,4419931604.00,Real Estate
CVU,CPI Aerostructures Inc. Common Stock,AMEX,72256889.00,Industrials
CVV,CVD Equipment Corporation Common Stock,NASDAQ,53719540.00,Technology
CVX,Chevron Corporation Common Stock,NYSE,336978336254.00,Energy
CW,Curtiss-Wright Corporation Common Stock,NYSE,28083781108.00,Technology
CWBC,Community West Bancshares Common Stock,NASDAQ,731809536.00,Finance
CWCO,Consolidated Water Co. Ltd. Ordinary Shares,NASDAQ,471045594.00,Utilities
CWD,CaliberCos Inc. Class A Common Stock,NASDAQ,10873476.00,Finance
CWEN,Clearway Energy Inc. Class C Common Stock,NYSE,3963960000.00,Utilities
CWH,Camping World Holdings Inc. Class A Common Stock,NYSE,744594195.00,Consumer Discretionary
CWK,Cushman & Wakefield Ltd. Common Shares,NYSE,3277864065.00,Finance
CWST,Casella Waste Systems Inc. Class A Common Stock,NASDAQ,6201333148.00,Utilities
CWT,California Water Service Group Common Stock,NYSE,3006429350.00,Utilities
CX,Cemex S.A.B. de C.V. Sponsored ADR,NYSE,18630609053.00,Industrials
CXAI,CXApp Inc. Class A Common Stock,NASDAQ,11697900.00,Technology
CXAIW,CXApp Inc. Warrant,NASDAQ,3658660.00,Technology
CXDO,Crexendo Inc. Common Stock,NASDAQ,247005142.00,Telecommunications
CXII,Churchill Capital Corp XII Class A Ordinary Shares,NASDAQ,0.00,Finance
CXIIU,Churchill Capital Corp XII Units,NASDAQ,0.00,Finance
CXIIW,Churchill Capital Corp XII Warrants,NASDAQ,0.00,Finance
CXM,Sprinklr Inc. Class A Common Stock,NYSE,1267177602.00,Technology
CXT,Crane NXT Co. Common Stock,NYSE,3020974268.00,Industrials
CXW,CoreCivic Inc. Common Stock,NYSE,3068508914.00,Real Estate
CYAB,Cyabra Inc. Common Stock,NASDAQ,5431591.00,Technology
CYCN,Cyclerion Therapeutics Inc. Common Stock,NASDAQ,14852977.00,Health Care
CYCU,Cycurion Inc. Common Stock,NASDAQ,6182076.00,Technology
CYCUW,Cycurion Inc. Warrant,NASDAQ,221779.00,Technology
CYD,China Yuchai International Limited Common Stock,NYSE,1627919992.00,Industrials
CYH,Community Health Systems Inc. Common Stock,NYSE,549575177.00,Health Care
CYN,Cyngn Inc. Common Stock,NASDAQ,19182964.00,Technology
CYPH,Cypherpunk Technologies Inc. Common Stock,NASDAQ,70905345.00,Health Care
CYRX,CryoPort Inc. Common Stock,NASDAQ,780731828.00,Health Care
CYTK,Cytokinetics Incorporated Common Stock,NASDAQ,10762172547.00,Health Care
CZFS,Citizens Financial Services Inc. Common Stock,NASDAQ,346964429.00,Finance
CZNC,Citizens & Northern Corp Common Stock,NASDAQ,423368927.00,Finance
CZR,Caesars Entertainment Inc. Common Stock,NASDAQ,6189741903.00,Consumer Discretionary
CZWI,Citizens Community Bancorp Inc. Common Stock,NASDAQ,228276131.00,Finance
D,Dominion Energy Inc. Common Stock,NYSE,61342014359.00,Utilities
DAAQ,Digital Asset Acquisition Corp. Class A Ordinary shares,NASDAQ,0.00,Finance
DAAQU,Digital Asset Acquisition Corp. Units,NASDAQ,0.00,Finance
DAAQW,Digital Asset Acquisition Corp. Warrant,NASDAQ,0.00,Finance
DAC,Danaos Corporation Common Stock,NYSE,2226649062.00,Consumer Discretionary
DAIC,CID HoldCo Inc. Common Stock,NASDAQ,2239209.00,Technology
DAICW,CID HoldCo Inc. Warrants,NASDAQ,12104.00,Technology
DAIO,Data I/O Corporation Common Stock,NASDAQ,38593625.00,Industrials
DAKT,Daktronics Inc. Common Stock,NASDAQ,961351244.00,Consumer Discretionary
DAL,Delta Air Lines Inc. Common Stock,NYSE,60936225035.00,Consumer Discretionary
DAN,Dana Incorporated Common Stock ,NYSE,2696151262.00,Consumer Discretionary
DAO,Youdao Inc. American Depositary Shares each representing one Class A Ordinary Share,NYSE,1518790004.00,Real Estate
DAR,Darling Ingredients Inc. Common Stock,NYSE,8984163830.00,Consumer Staples
DARE,Dare Bioscience Inc. Common Stock,NASDAQ,31307159.00,Health Care
DASH,DoorDash Inc. Class A Common Stock,NASDAQ,83662351811.00,Technology
DAVA,Endava plc American Depositary Shares (each representing one Class A Ordinary Share),NYSE,163526085.00,Technology
DAVE,Dave Inc. Class A Common Stock,NASDAQ,4963386228.00,Finance
DAVEW,Dave Inc. Warrants,NASDAQ,32289687.00,Finance
DB,Deutsche Bank AG Common Stock,NYSE,67467004000.00,Finance
DBCA,D. Boral Acquisition I Corp. Class A Ordinary Shares,NASDAQ,0.00,Finance
DBCAW,D. Boral Acquisition I Corp. Warrants,NASDAQ,0.00,Finance
DBD,Diebold Nixdorf Incorporated Common stock,NYSE,2879697079.00,Miscellaneous
DBGI,Digital Brands Group Inc. Common Stock,NASDAQ,17572459.00,Consumer Discretionary
DBI,Designer Brands Inc. Class A Common Stock,NYSE,280289476.00,Consumer Discretionary
DBL,DoubleLine Opportunistic Credit Fund Common Shares of Beneficial Interest,NYSE,0.00,
DBRG,DigitalBridge Group Inc.,NYSE,2877836188.00,Real Estate
DBVT,DBV Technologies S.A. American Depositary Shares,NASDAQ,936678296.00,Health Care
DBX,Dropbox Inc. Class A Common Stock,NASDAQ,6663066535.00,Technology
DC,Dakota Gold Corp. Common Stock,AMEX,599997875.00,Basic Materials
DCBG,Dime Commercial Bancshares Inc. 9.000% Junior Subordinated Notes,NYSE,1020217395.00,Finance
DCBO,Docebo Inc. Common Shares,NASDAQ,468808493.00,Technology
DCGO,DocGo Inc. Common Stock,NASDAQ,54881286.00,Health Care
DCH,Dauch Corporation Common Stock,NYSE,1217691335.00,Consumer Discretionary
DCI,Donaldson Company Inc. Common Stock,NYSE,10326515979.00,Industrials
DCO,Ducommun Incorporated Common Stock,NYSE,2814965309.00,Industrials
DCOM,Dime Commercial Bancshares Inc. Common Stock,NYSE,1769078319.00,Finance
DCOY,Decoy Therapeutics Inc. Common Stock,NASDAQ,3888686.00,Health Care
DCTH,Delcath Systems Inc. Common Stock,NASDAQ,455685740.00,Health Care
DCX,Digital Currency X Technology Inc. Class A Ordinary Shares,NASDAQ,19824961.00,Industrials
DD,DuPont de Nemours Inc. Common Stock,NYSE,19114850197.00,Industrials
DDC,DDC Enterprise Limited Class A Ordinary Shares,AMEX,42858921.00,Consumer Staples
DDD,3D Systems Corporation Common Stock,NYSE,411451748.00,Technology
DDI,DoubleDown Interactive Co. Ltd. American Depository Shares,NASDAQ,569369026.00,Technology
DDL,Dingdong (Cayman) Limited American Depositary Shares (each two representing three Ordinary Shares),NYSE,458281709.00,Consumer Discretionary
DDOG,Datadog Inc. Class A Common Stock,NASDAQ,92677794808.00,Technology
DDS,Dillard's Inc. Common Stock,NYSE,8547130726.00,Consumer Discretionary
DDT,Dillard's Capital Trust I,NYSE,408605361.00,Consumer Discretionary
DE,Deere & Company Common Stock,NYSE,167704024030.00,Industrials
DEA,Easterly Government Properties Inc. Common Stock,NYSE,1186317012.00,Real Estate
DEC,Diversified Energy Company Common Stock,NYSE,1097614961.00,
DECK,Deckers Outdoor Corporation Common Stock,NYSE,14539447388.00,Consumer Discretionary
DEFT,Defi Technologies Inc. Common Stock,NASDAQ,205584874.00,Finance
DEI,Douglas Emmett Inc. Common Stock,NYSE,2095240690.00,Real Estate
DELL,Dell Technologies Inc. Class C Common Stock ,NYSE,255561943011.00,Technology
DEO,Diageo plc Common Stock,NYSE,45730514393.00,Consumer Staples
DERM,Journey Medical Corporation Common Stock,NASDAQ,195219938.00,Health Care
DETX,Liberty Defense Holdings Ltd. Common Shares,NASDAQ,22688343.00,Telecommunications
DFDV,DeFi Development Corp. Common Stock,NASDAQ,99390077.00,Finance
DFDVW,DeFi Development Corp. Warrant,NASDAQ,11743088.00,
DFH,Dream Finders Homes Inc. Class A Common Stock,NYSE,1536879903.00,Consumer Discretionary
DFIN,Donnelley Financial Solutions Inc. Common Stock ,NYSE,1154435549.00,Consumer Discretionary
DFLI,Dragonfly Energy Holdings Corp. Common Stock (NV),NASDAQ,24477299.00,Miscellaneous
DFLIW,Dragonfly Energy Holdings Corp. Warrant,NASDAQ,512614.00,Miscellaneous
DFNS,T3 Defense Inc. Common Stock,NASDAQ,15068880.00,Consumer Discretionary
DFNSW,T3 Defense Inc. Warrants,NASDAQ,8525440.00,Consumer Discretionary
DFP,Flaherty & Crumrine Dynamic Preferred and Income Fund Inc. Common Stock,NYSE,0.00,Finance
DFSC,DEFSEC Technologies Inc. Common Stock,NASDAQ,4346105.00,Technology
DFSCW,DEFSEC Technologies Inc. Warrant,NASDAQ,40471.00,Technology
DFTX,Definium Therapeutics Inc. Common Shares,NASDAQ,4819661141.00,Health Care
DG,Dollar General Corporation Common Stock,NYSE,26066724076.00,Consumer Discretionary
DGICA,Donegal Group Inc. Class A Common Stock,NASDAQ,714686842.00,Finance
DGICB,Donegal Group Inc. Class B Common Stock,NASDAQ,806940353.00,Finance
DGII,Digi International Inc. Common Stock,NASDAQ,2720213658.00,Telecommunications
DGNX,Diginex Limited Ordinary Shares,NASDAQ,33466082.00,Technology
DGX,Quest Diagnostics Incorporated Common Stock,NYSE,23879433664.00,Health Care
DGXX,Digi Power X Inc. Subordinate Voting Shares,NASDAQ,321114265.00,Finance
DH,Definitive Healthcare Corp. Class A Common Stock,NASDAQ,112081541.00,Technology
DHC,Diversified Healthcare Trust Common Shares of Beneficial Interest,NASDAQ,2234646927.00,Real Estate
DHCNI,Diversified Healthcare Trust 5.625% Senior Notes due 2042,NASDAQ,4348910651.00,Real Estate
DHCNL,Diversified Healthcare Trust 6.25% Senior Notes Due 2046,NASDAQ,4475822179.00,Real Estate
DHF,BNY Mellon High Yield Strategies Fund Common Stock,NYSE,0.00,Finance
DHI,D.R. Horton Inc. Common Stock,NYSE,44967219233.00,Consumer Discretionary
DHR,Danaher Corporation Common Stock,NYSE,140089040202.00,Industrials
DHT,DHT Holdings Inc.,NYSE,2766695324.00,Consumer Discretionary
DHX,DHI Group Inc. Common Stock,NYSE,159834476.00,Consumer Discretionary
DHY,Credit Suisse High Yield Credit Fund Common Stock,AMEX,0.00,Finance
DIBS,1stdibs.com Inc. Common Stock,NASDAQ,172427534.00,Consumer Discretionary
DIN,Dine Brands Global Inc. Common Stock,NYSE,463008888.00,Consumer Discretionary
DINO,HF Sinclair Corporation Common Stock,NYSE,13069969183.00,Energy
DIOD,Diodes Incorporated Common Stock,NASDAQ,4422180648.00,Technology
DIS,Walt Disney Company (The) Common Stock,NYSE,172782886688.00,Consumer Discretionary
DIT,AMCON Distributing Company Common Stock,AMEX,68321960.00,Consumer Discretionary
DJCO,Daily Journal Corp. (S.C.) Common Stock,NASDAQ,805733157.00,Consumer Discretionary
DJT,Trump Media & Technology Group Corp. Common Stock,NASDAQ,2365185691.00,Technology
DJTWW,Trump Media & Technology Group Corp. Warrants,NASDAQ,991494704.00,Technology
DK,Delek US Holdings Inc. Common Stock,NYSE,3224337585.00,Energy
DKI,DarkIris Inc. Class A Ordinary Shares,NASDAQ,9847137.00,Technology
DKL,Delek Logistics Partners L.P. Common Units representing Limited Partner Interests,NYSE,2778038659.00,Energy
DKNG,DraftKings Inc. Class A Common Stock,NASDAQ,12844775072.00,Consumer Discretionary
DKS,Dick's Sporting Goods Inc Common Stock,NYSE,21138709189.00,Consumer Discretionary
DLB,Dolby Laboratories Common Stock,NYSE,4838693582.00,Miscellaneous
DLHC,DLH Holdings Corp.,NASDAQ,76233364.00,Consumer Discretionary
DLNG,Dynagas LNG Partners LP Common Units,NYSE,129883779.00,Consumer Discretionary
DLO,DLocal Limited Class A Common Shares,NASDAQ,4388587505.00,Consumer Discretionary
DLPN,Dolphin Entertainment Inc. Common Stock,NASDAQ,14579344.00,Consumer Discretionary
DLR,Digital Realty Trust Inc. Common Stock,NYSE,60898671931.00,Real Estate
DLTH,Duluth Holdings Inc. Class B Common Stock,NASDAQ,169109216.00,Consumer Discretionary
DLTR,Dollar Tree Inc. Common Stock,NASDAQ,23839257641.00,Consumer Discretionary
DLX,Deluxe Corporation Common Stock,NYSE,1113010523.00,Consumer Discretionary
DLXY,Delixy Holdings Limited Class A Ordinary Shares,NASDAQ,7153125.00,Energy
DLY,DoubleLine Yield Opportunities Fund Common Shares of Beneficial Interest,NYSE,676035484.00,Finance
DMA,Destra Multi-Alternative Fund Common Stock,NYSE,0.00,Finance
DMAA,Drugs Made In America Acquisition Corp. Ordinary Shares,NASDAQ,0.00,
DMAAR,Drugs Made In America Acquisition Corp. Rights,NASDAQ,0.00,Finance
DMAAU,Drugs Made In America Acquisition Corp. Units,NASDAQ,0.00,Finance
DMAC,DiaMedica Therapeutics Inc. Common Stock,NASDAQ,410591089.00,Health Care
DMB,BNY Mellon Municipal Bond Infrastructure Fund Inc. Common Stock,NYSE,0.00,Finance
DMC,Del Monte Corporation Ordinary Shares,NYSE,1342611906.00,
DMII,Drugs Made In America Acquisition II Corp. Ordinary Shares,NASDAQ,0.00,Finance
DMIIR,Drugs Made In America Acquisition II Corp. Right,NASDAQ,0.00,Finance
DMLP,Dorchester Minerals L.P. Common Units Representing Limited Partnership Interests,NASDAQ,1224240767.00,Energy
DMO,Western Asset Mortgage Opportunity Fund Inc. Common Stock,NYSE,0.00,Finance
DMRA,Damora Therapeutics Inc. Common Stock,NASDAQ,1845364756.00,Health Care
DMRC,Digimarc Corporation Common Stock,NASDAQ,174822837.00,Technology
DNA,Ginkgo Bioworks Holdings Inc. Class A Common Stock,NYSE,646208649.00,Health Care
DNLI,Denali Therapeutics Inc. Common Stock,NASDAQ,4099472507.00,Health Care
DNMX,Dynamix Corporation III Class A Ordinary Shares,NASDAQ,0.00,Finance
DNMXU,Dynamix Corporation III Unit,NASDAQ,0.00,Finance
DNMXW,Dynamix Corporation III Warrants,NASDAQ,0.00,Finance
DNN,Denison Mines Corp Ordinary Shares (Canada),AMEX,2896054278.00,Basic Materials
DNOW,DNOW Inc. Common Stock,NYSE,2300079398.00,Consumer Discretionary
DNP,DNP Select Income Fund Inc. Common Stock,NYSE,0.00,Finance
DNTH,Dianthus Therapeutics Inc. Common Stock,NASDAQ,5157212421.00,Health Care
DNUT,Krispy Kreme Inc. Common Stock,NASDAQ,605124000.00,Consumer Staples
DOC,Healthpeak Properties Inc. Common Stock,NYSE,15091397277.00,Real Estate
DOCN,DigitalOcean Holdings Inc. Common Stock,NYSE,13580910874.00,Technology
DOCS,Doximity Inc. Class A Common Stock,NYSE,3997582947.00,Technology
DOCU,DocuSign Inc. Common Stock,NASDAQ,8739534708.00,Technology
DOGZ,Dogness (International) Corporation Class A Common Stock,NASDAQ,15816617.00,Consumer Discretionary
DOLE,Dole plc Ordinary Shares,NYSE,1334128479.00,Consumer Staples
DOMH,Dominari Holdings Inc. Common Stock,NASDAQ,66484516.00,Health Care
DOMO,Domo Inc. Class B Common Stock,NASDAQ,159832993.00,Technology
DOO,BRP Inc. Common Subordinate Voting Shares,NASDAQ,4273135419.00,Consumer Discretionary
DORM,Dorman Products Inc. Common Stock,NASDAQ,4113365906.00,Consumer Discretionary
DOUG,Douglas Elliman Inc. Common Stock,NYSE,178175921.00,Finance
DOV,Dover Corporation Common Stock,NYSE,28778490786.00,Industrials
DOW,Dow Inc. Common Stock ,NYSE,19971745247.00,Industrials
DOX,Amdocs Limited Ordinary Shares,NASDAQ,5586388643.00,Technology
DOYU,DouYu International Holdings Limited ADS,NASDAQ,144556735.00,Technology
DPC,DPC Holdings PLC Ordinary Shares,NYSE,6814500773.00,Telecommunications
DPG,Duff & Phelps Utility and Infrastructure Fund Inc.,NYSE,0.00,Finance
DPRO,Draganfly Inc. Common Shares,NASDAQ,186859208.00,Industrials
DPZ,Domino's Pizza Inc Common Stock,NASDAQ,10366394404.00,Consumer Discretionary
DQ,DAQO New Energy Corp. American Depositary Shares each representing five ordinary shares,NYSE,828910178.00,Technology
DRCT,Direct Digital Holdings Inc. Class A Common Stock,NASDAQ,2227819.00,Consumer Discretionary
DRD,DRDGOLD Limited American Depositary Shares,NYSE,1893449275.00,Basic Materials
DRDB,Roman DBDR Acquisition Corp. II Ordinary shares,NASDAQ,0.00,
DRDBW,Roman DBDR Acquisition Corp. II Warrants,NASDAQ,0.00,
DRH,Diamondrock Hospitality Company Common Stock,NASDAQ,2470246339.00,Real Estate
DRI,Darden Restaurants Inc. Common Stock,NYSE,23401791813.00,Consumer Discretionary
DRIO,DarioHealth Corp. Common Stock,NASDAQ,53234257.00,Health Care
DRMA,Dermata Therapeutics Inc. Common Stock,NASDAQ,5389672.00,Health Care
DRMAW,Dermata Therapeutics Inc. Warrant,NASDAQ,50277.00,Health Care
DRS,Leonardo DRS Inc. Common Stock,NASDAQ,11662838444.00,Industrials
DRTS,Alpha Tau Medical Ltd. Ordinary Shares,NASDAQ,1164368821.00,Health Care
DRTSW,Alpha Tau Medical Ltd. Warrant,NASDAQ,303633593.00,Health Care
DRUG,Bright Minds Biosciences Inc. Common Stock,NASDAQ,663295324.00,Health Care
DRVN,Driven Brands Holdings Inc. Common Stock,NASDAQ,2386912799.00,Consumer Discretionary
DSAC,Daedalus Special Acquisition Corp. Class A Ordinary Shares,NASDAQ,0.00,Finance
DSACW,Daedalus Special Acquisition Corp. Warrant,NASDAQ,0.00,Finance
DSC,DSC Holdings Ltd. American Depositary Shares,NASDAQ,2542659241.00,Technology
DSGN,Design Therapeutics Inc. Common Stock,NASDAQ,976827073.00,Health Care
DSGR,Distribution Solutions Group Inc. Common Stock,NASDAQ,1256508488.00,Consumer Discretionary
DSGX,Descartes Systems Group Inc. (The) Common Stock,NASDAQ,6237863751.00,Technology
DSL,DoubleLine Income Solutions Fund Common Shares of Beneficial Interests,NYSE,1122985076.00,Finance
DSM,BNY Mellon Strategic Municipal Bond Fund Inc. Common Stock,NYSE,0.00,Finance
DSP,Viant Technology Inc. Class A Common Stock,NASDAQ,849319629.00,Technology
DSS,DSS Inc. Common Stock,AMEX,6117902.00,Consumer Discretionary
DSU,Blackrock Debt Strategies Fund Inc. Common Stock,NYSE,0.00,Finance
DSWL,Deswell Industries Inc. Common Shares,NASDAQ,54657870.00,Industrials
DSX,Diana Shipping inc. common stock,NYSE,259433490.00,Consumer Discretionary
DSY,Big Tree Cloud Holdings Limited Class A Ordinary Shares,NASDAQ,21240868.00,Consumer Discretionary
DSYWW,Big Tree Cloud Holdings Limited Warrants,NASDAQ,133052.00,Consumer Discretionary
DT,Dynatrace Inc. Common Stock,NYSE,13049368566.00,Technology
DTB,DTE Energy Company 2020 Series G 4.375% Junior Subordinated Debentures due 2080,NYSE,3440809100.00,Utilities
DTCX,Datacentrex Inc. Common Stock,NASDAQ,66085164.00,Technology
DTE,DTE Energy Company Common Stock,NYSE,32048841901.00,Utilities
DTF,DTF Tax-Free Income 2028 Term Fund Inc. Common Stock,NYSE,81121203.00,Finance
DTG,DTE Energy Company 2021 Series E 4.375% Junior Subordinated Debentures,NYSE,3533548122.00,Utilities
DTI,Drilling Tools International Corporation Common Stock,NASDAQ,73089316.00,Consumer Discretionary
DTIL,Precision BioSciences Inc. Common Stock,NASDAQ,211062380.00,Health Care
DTK,DTE Energy Company 2025 Series H 6.25% Junior Subordinated Debentures due 2085,NYSE,0.00,Utilities
DTM,DT Midstream Inc. Common Stock ,NYSE,14750221322.00,Utilities
DTSQ,DT Cloud Star Acquisition Corporation Ordinary Shares,NASDAQ,0.00,
DTSQU,DT Cloud Star Acquisition Corporation Units,NASDAQ,0.00,
DTSS,Datasea Intelligent Technology Ltd. Class A Ordinary Shares,NASDAQ,8357722.00,Technology
DTST,Data Storage Corporation Common Stock,NASDAQ,7324926.00,Technology
DTW,DTE Energy Company 2017 Series E 5.25% Junior Subordinated Debentures due 2077,NYSE,4272901549.00,Utilities
DUK,Duke Energy Corporation (Holding Company) Common Stock,NYSE,101035669723.00,Utilities
DUKB,Duke Energy Corporation 5.625% Junior Subordinated Debentures due 2078,NYSE,18164591856.00,Utilities
DUKR,DUKE Robotics Corp. Common Stock,NASDAQ,16358290.00,Industrials
DUKRW,DUKE Robotics Corp. Warrant,NASDAQ,3305738.00,Industrials
DUO,Fangdd Network Group Ltd. Class A Ordinary Shares,NASDAQ,28521971.00,Finance
DUOL,Duolingo Inc. Class A Common Stock,NASDAQ,5859550394.00,Technology
DUOT,Duos Technologies Group Inc. Common Stock,NASDAQ,300749929.00,Technology
DV,DoubleVerify Holdings Inc. Common Stock,NYSE,1755630322.00,Technology
DVA,DaVita Inc. Common Stock,NYSE,15081222000.00,Health Care
DVLT,Datavault AI Inc. Common Stock,NASDAQ,328621362.00,Technology
DVN,Devon Energy Corporation Common Stock,NYSE,46678223740.00,Energy
DWSN,Dawson Geophysical Company Common Stock,NASDAQ,182901228.00,Energy
DWTX,Dogwood Therapeutics Inc. Common Stock,NASDAQ,50108034.00,Health Care
DX,Dynex Capital Inc. Common Stock,NYSE,2799113300.00,Real Estate
DXC,DXC Technology Company Common Stock ,NYSE,1639963396.00,Technology
DXCM,DexCom Inc. Common Stock,NASDAQ,27493449611.00,Health Care
DXF,Eason Technology Limited American Depositary Shares (each representing sixty-thousand (60000) Ordinary Shares),AMEX,2063246.00,Finance
DXLG,Destination XL Group Inc. Common Stock,NASDAQ,36281258.00,Consumer Discretionary
DXPE,DXP Enterprises Inc. Common Stock,NASDAQ,2449529190.00,Industrials
DXR,Daxor Corporation Common Stock,NASDAQ,60601349.00,Health Care
DXST,Decent Holding Inc Class A Ordinary Shares,NASDAQ,3993227.00,Industrials
DXYZ,Destiny Tech100 Inc. Common Stock,NYSE,0.00,
DY,Dycom Industries Inc. Common Stock,NYSE,13146569741.00,Industrials
DYAI,Dyadic International Inc. Common Stock,NASDAQ,34270600.00,Health Care
DYN,Dyne Therapeutics Inc. Common Stock,NASDAQ,3813789274.00,Health Care
DYNC,Dynamix Corporation Class A Ordinary Shares,NASDAQ,0.00,
DYNCU,Dynamix Corporation Unit,NASDAQ,0.00,
DYNCW,Dynamix Corporation Warrant,NASDAQ,0.00,
DYOR,Insight Digital Partners II Class A Ordinary Shares,NASDAQ,0.00,Finance
DYORU,Insight Digital Partners II Units,NASDAQ,0.00,Finance
DYORW,Insight Digital Partners II Warrants,NASDAQ,0.00,Finance
E,ENI S.p.A. Common Stock,NYSE,73744440447.00,Energy
EA,Electronic Arts Inc. Common Stock,NASDAQ,51456712032.00,Consumer Discretionary
EAD,Allspring Income Opportunities Fund Common Shares,AMEX,0.00,Finance
EAF,GrafTech International Ltd. Common Stock,NYSE,147951703.00,Energy
EAI,Entergy Arkansas LLC First Mortgage Bonds 4.875% Series Due September 1 2066,NYSE,9152063079.00,Utilities
EARN,Ellington Credit Company Common Shares of Beneficial Interest,NYSE,163758090.00,Real Estate
EAT,Brinker International Inc. Common Stock,NYSE,7621589161.00,Consumer Discretionary
EBAY,eBay Inc. Common Stock,NASDAQ,51105084026.00,Consumer Discretionary
EBC,Eastern Bankshares Inc. Common Stock,NASDAQ,5168359694.00,Finance
EBF,Ennis Inc. Common Stock,NYSE,543659865.00,Consumer Discretionary
EBMT,Eagle Bancorp Montana Inc. Common Stock,NASDAQ,188302789.00,Finance
EBON,Ebang International Holdings Inc. Class A Ordinary Shares,NASDAQ,13087876.00,Technology
EBS,Emergent BioSolutions Inc. Common Stock,NYSE,427217331.00,Health Care
EC,Ecopetrol S.A. American Depositary Shares,NYSE,30220770605.00,Energy
ECAT,BlackRock ESG Capital Allocation Term Trust Common Shares of Beneficial Interest,NYSE,1708533000.00,Finance
ECBK,ECB Bancorp Inc. Common Stock,NASDAQ,176830194.00,Finance
ECC,Eagle Point Credit Company Common Share of Beneficial Interest,NYSE,234157343.00,Finance
ECCC,Eagle Point Credit Company 6.50% Series C Term Preferred Stock due 2031,NYSE,1517169725.00,Finance
ECCU,Eagle Point Credit Company 7.75% Notes due 2030,NYSE,0.00,
ECCV,Eagle Point Credit Company 5.375% Notes due 2029,NYSE,1447407823.00,Finance
ECF,Ellsworth Growth and Income Fund Ltd.,AMEX,0.00,Finance
ECG,Everus Construction Group Inc. Common Stock,NYSE,7057012446.00,Consumer Discretionary
ECHO,EchoStar  Corporation Common Stock,NASDAQ,29416069032.00,Consumer Discretionary
ECL,Ecolab Inc. Common Stock,NYSE,79748130567.00,Consumer Discretionary
ECO,Okeanis Eco Tankers Corp. Common Stock,NYSE,2073661627.00,Consumer Discretionary
ECOR,electroCore Inc. Common Stock,NASDAQ,72753350.00,Health Care
ECPG,Encore Capital Group Inc Common Stock,NASDAQ,1942715731.00,Finance
ECVT,Ecovyst Inc. Common Stock,NYSE,1294834716.00,Industrials
ECX,ECARX Holdings Inc. Class A Ordinary shares,NASDAQ,476324980.00,Technology
ED,Consolidated Edison Inc. Common Stock,NYSE,42008701073.00,Utilities
EDBL,Edible Garden AG Incorporated Common Stock,NASDAQ,689134.00,Consumer Staples
EDBLW,Edible Garden AG Incorporated Warrant,NASDAQ,259245.00,Consumer Staples
EDD,Morgan Stanley Emerging Markets Domestic Debt Fund Inc. Common Stock,NYSE,0.00,Finance
EDF,Virtus Stone Harbor Emerging Markets Income Fund Common Shares of Beneficial Interest,NYSE,0.00,Finance
EDHL,Everbright Digital Holding Limited Ordinary Shares,NASDAQ,6631775.00,Consumer Discretionary
EDIT,Editas Medicine Inc. Common Stock,NASDAQ,357357929.00,Health Care
EDN,Empresa Distribuidora Y Comercializadora Norte S.A. (Edenor) American Depositary Shares,NYSE,1098498146.00,Utilities
EDRY,EuroDry Ltd. Common Shares ,NASDAQ,63852183.00,Consumer Discretionary
EDSA,Edesa Biotech Inc. Common Shares,NASDAQ,66689633.00,Health Care
EDTK,Skillful Craftsman Education Technology Limited Ordinary Share,NASDAQ,15802015.00,Real Estate
EDU,New Oriental Education & Technology Group Inc. Sponsored ADR representing 10 Ordinary Share (Cayman Islands),NYSE,18711561227.00,Real Estate
EDUC,Educational Development Corporation Common Stock,NASDAQ,13107501.00,Consumer Discretionary
EE,Excelerate Energy Inc. Class A Common Stock,NYSE,4325511692.00,Utilities
EEA,The European Equity Fund Inc. Common Stock,NYSE,0.00,Finance
EEFT,Euronet Worldwide Inc. Common Stock,NASDAQ,2938635755.00,Finance
EEIQ,EpicQuest Education Group International Limited Common Stock,NASDAQ,4347085.00,Real Estate
EEX,Emerald Holding Inc. Common Stock,NYSE,995484599.00,Consumer Discretionary
EFC,Ellington Financial Inc. Common Stock ,NYSE,1689052115.00,Finance
EFOI,Energy Focus Inc. Common Stock,NASDAQ,18595127.00,Consumer Discretionary
EFOR,Everforth Inc. Common Stock,NYSE,726792496.00,Consumer Discretionary
EFR,Eaton Vance Senior Floating-Rate Fund Common Shares of Beneficial Interest,NYSE,0.00,Finance
EFSC,Enterprise Financial Services Corporation Common Stock,NASDAQ,2407345969.00,Finance
EFSCP,Enterprise Financial Services Corporation Depositary Shares Each Representing a 1/40th Interest in a Share of 5% Fixed Rate Non-Cumulative Perpetual Preferred Stock Series A,NASDAQ,750374861.00,Finance
EFSI,Eagle Financial Services Inc Common Stock,NASDAQ,221420302.00,Finance
EFT,Eaton Vance Floating Rate Income Trust Common Shares of Beneficial Interest,NYSE,313594674.00,Finance
EFX,Equifax Inc. Common Stock,NYSE,20488789417.00,Finance
EFXT,Enerflex Ltd Common Shares,NYSE,2817305298.00,Industrials
EG,Everest Group Ltd. Common Stock,NYSE,14694914403.00,Finance
EGAN,eGain Corporation Common Stock,NASDAQ,179249029.00,Technology
EGBN,Eagle Bancorp Inc. Common Stock,NASDAQ,841374045.00,Finance
EGG,Enigmatig Limited Class A Ordinary Shares,AMEX,185170580.00,Consumer Discretionary
EGHA,EGH Acquisition Corp. Class A Ordinary Shares,NASDAQ,0.00,Finance
EGHAR,EGH Acquisition Corp. Rights,NASDAQ,0.00,Finance
