symbol,name,exchange,market_cap,sector
A,Agilent Technologies Inc. Common Stock,NYSE,36911030761.00,Industrials
AA,Alcoa Corporation Common Stock ,NYSE,12846159115.00,Industrials
AACB,Artius II Acquisition Inc. Class A Ordinary Shares,NASDAQ,0.00,
AACBR,Artius II Acquisition Inc. Rights,NASDAQ,0.00,
AACG,ATA Creativity Global American Depositary Shares,NASDAQ,44751197.00,Real Estate
AACI,Armada Acquisition Corp. III Class A Ordinary Share,NASDAQ,0.00,Finance
AACIU,Armada Acquisition Corp. III Units,NASDAQ,0.00,Finance
AACIW,Armada Acquisition Corp. III Warrant,NASDAQ,0.00,Finance
AACO,Abony Acquisition Corp. I Class A Ordinary Share,NASDAQ,0.00,
AACOU,Abony Acquisition Corp. I Units,NASDAQ,0.00,
AACOW,Abony Acquisition Corp. I Warrants,NASDAQ,0.00,
AACP,Apogee Acquisition Corp Class A Ordinary Shares,NASDAQ,0.00,Finance
AACPR,Apogee Acquisition Corp Rights,NASDAQ,0.00,Finance
AACPU,Apogee Acquisition Corp Units,NASDAQ,0.00,Finance
AACPW,Apogee Acquisition Corp Warrant,NASDAQ,0.00,Finance
AADX,Applied Aerospace & Defense Inc. Common Stock,NYSE,3937345525.00,Industrials
AAL,American Airlines Group Inc. Common Stock,NASDAQ,11852021655.00,Consumer Discretionary
AAME,Atlantic American Corporation Common Stock,NASDAQ,34879260.00,Finance
AAMI,Acadian Asset Management Inc. Common Stock,NYSE,2604122733.00,Finance
AAOI,Applied Optoelectronics Inc. Common Stock,NASDAQ,9705362669.00,Technology
AAON,AAON Inc. Common Stock,NASDAQ,8815338230.00,Industrials
AAP,Advance Auto Parts Inc.,NYSE,3712056168.00,Consumer Discretionary
AAPG,Ascentage Pharma Group International American Depository Shares,NASDAQ,1726615138.00,Health Care
AAPL,Apple Inc. Common Stock,NASDAQ,4532958682280.00,Technology
AARD,Aardvark Therapeutics Inc. Common Stock,NASDAQ,124739701.00,Health Care
AAT,American Assets Trust Inc. Common Stock,NYSE,1566082777.00,Real Estate
AAUC,Allied Gold Corporation Common Shares,NYSE,3097140000.00,
AB,AllianceBernstein Holding L.P.  Units,NYSE,3391493902.00,Finance
ABAT,American Battery Technology Company Common Stock,NASDAQ,383324489.00,Basic Materials
ABBV,AbbVie Inc. Common Stock,NYSE,461256601778.00,Health Care
ABCB,Ameris Bancorp Common Stock,NYSE,6152890640.00,Finance
ABCL,AbCellera Biologics Inc. Common Shares,NASDAQ,2389737465.00,Health Care
ABEO,Abeona Therapeutics Inc. Common Stock,NASDAQ,364768922.00,Health Care
ABEV,Ambev S.A. American Depositary Shares (Each representing 1 Common Share),NYSE,48861080144.00,Consumer Staples
ABG,Asbury Automotive Group Inc Common Stock,NYSE,3824301520.00,Consumer Discretionary
ABLV,Able View Global Inc. Class B Ordinary Shares,NASDAQ,58774007.00,Consumer Discretionary
ABLVW,Able View Global Inc. Warrant,NASDAQ,928531.00,Consumer Discretionary
ABM,ABM Industries Incorporated Common Stock,NYSE,2593377461.00,Consumer Discretionary
ABNB,Airbnb Inc. Class A Common Stock,NASDAQ,89760844182.00,Consumer Discretionary
ABOS,Acumen Pharmaceuticals Inc. Common Stock,NASDAQ,197903569.00,Health Care
ABR,Arbor Realty Trust Common Stock,NYSE,1013743540.00,Real Estate
ABSI,Absci Corporation Common Stock,NASDAQ,1811616751.00,Health Care
ABT,Abbott Laboratories Common Stock,NYSE,166168905727.00,Health Care
ABTC,American Bitcoin Corp. Class A Common Stock,NASDAQ,597094517.00,Technology
ABTS,Abits Group Inc Ordinary Shares,NASDAQ,3464893.00,Technology
ABUS,Arbutus Biopharma Corporation Common Stock,NASDAQ,962008648.00,Health Care
ABVC,ABVC BioPharma Inc. Common Stock,NASDAQ,46800796.00,Health Care
ABVX,Abivax SA American Depositary Shares,NASDAQ,11469470344.00,Health Care
ABX,Abacus Global Management Inc. Class A Common Stock,NYSE,1137639273.00,Finance
ABXL,Abacus Global Management Inc. 9.875% Fixed Rate Senior Notes due 2028,NYSE,1902116322.00,Finance
ACA,Arcosa Inc. Common Stock ,NYSE,7117499889.00,Industrials
ACAA,Averin Capital Acquisition Corp. Class A Ordinary Shares,NASDAQ,0.00,Finance
ACAAU,Averin Capital Acquisition Corp. Units,NASDAQ,0.00,Finance
ACAAW,Averin Capital Acquisition Corp. Warrants,NASDAQ,0.00,Finance
ACAD,ACADIA Pharmaceuticals Inc. Common Stock,NASDAQ,4446995544.00,Health Care
ACB,Aurora Cannabis Inc. Common Shares,NASDAQ,175915695.00,Health Care
ACCL,Acco Group Holdings Limited Class A Ordinary Shares,NASDAQ,23908000.00,Consumer Discretionary
ACCO,Acco Brands Corporation Common Stock,NYSE,387482735.00,Consumer Discretionary
ACCS,ACCESS Newswire Inc. Common Stock,AMEX,26747972.00,Consumer Discretionary
ACDC,ProFrac Holding Corp. Class A Common Stock,NASDAQ,931741878.00,Energy
ACEL,Accel Entertainment Inc. ,NYSE,1039387333.00,Consumer Discretionary
ACET,Adicet Bio Inc. Common Stock,NASDAQ,84134124.00,Health Care
ACFN,Acorn Energy Inc. Common Stock,NASDAQ,42364478.00,Consumer Discretionary
ACGC,ACP Holdings Acquisition Corp. Class A Ordinary Shares,NASDAQ,0.00,Finance
ACGCU,ACP Holdings Acquisition Corp. Units,NASDAQ,0.00,Finance
ACGCW,ACP Holdings Acquisition Corp. Warrants,NASDAQ,0.00,Finance
ACGL,Arch Capital Group Ltd. Common Stock,NASDAQ,35707615894.00,Finance
ACGLN,Arch Capital Group Ltd. Depositary Shares each Representing a 1/1000th Interest in a 4.550% Non-Cumulative Preferred Share Series G,NASDAQ,5656617430.00,Finance
ACGLO,Arch Capital Group Ltd. Depositary Shares Each Representing 1/1000th Interest in a Share of 5.45% Non-Cumulative Preferred Shares Series F,NASDAQ,6640149120.00,Finance
ACH,Accendra Health Inc. Common Stock,NYSE,274935490.00,Health Care
ACHC,Acadia Healthcare Company Inc. Common Stock,NASDAQ,2934667832.00,Health Care
ACHR,Archer Aviation Inc. Class A Common Stock,NYSE,3782798085.00,Industrials
ACHV,Achieve Life Sciences Inc. Common Shares,NASDAQ,657017965.00,Health Care
ACI,Albertsons Companies Inc. Class A Common Stock,NYSE,6987777317.00,Consumer Staples
ACIC,American Coastal Insurance Corporation Common Stock,NASDAQ,559275102.00,Finance
ACIU,AC Immune SA Common Stock,NASDAQ,255451668.00,Health Care
ACIW,ACI Worldwide Inc. Common Stock,NASDAQ,5579186962.00,Technology
ACLS,Axcelis Technologies Inc. Common Stock,NASDAQ,4441048117.00,Technology
ACM,AECOM Common Stock,NYSE,8706142601.00,Consumer Discretionary
ACMR,ACM Research Inc. Class A Common Stock,NASDAQ,6474805735.00,Technology
ACN,Accenture plc Class A Ordinary Shares (Ireland),NYSE,91682527344.00,Consumer Discretionary
ACNB,ACNB Corporation Common Stock,NASDAQ,615275651.00,Finance
ACNT,Ascent Industries Co. Common Stock,NASDAQ,137923161.00,Industrials
ACOG,Alpha Cognition Inc. Common Stock,NASDAQ,171797681.00,
ACON,Aclarion Inc. Common Stock,NASDAQ,7608353.00,Health Care
ACONW,Aclarion Inc. Warrant,NASDAQ,56878.00,Health Care
ACP,abrdn Income Credit Strategies Fund Common Shares,NYSE,0.00,Finance
ACR,ACRES Commercial Realty Corp. Common Stock,NYSE,128359818.00,Real Estate
ACRE,Ares Commercial Real Estate Corporation Common Stock,NYSE,250774631.00,Real Estate
ACRS,Aclaris Therapeutics Inc. Common Stock,NASDAQ,776530061.00,Health Care
ACRV,Acrivon Therapeutics Inc. Common Stock,NASDAQ,73618974.00,Health Care
ACT,Enact Holdings Inc. Common Stock,NASDAQ,6329497778.00,Finance
ACTG,Acacia Research Corporation (Acacia Tech) Common Stock,NASDAQ,438514659.00,Miscellaneous
ACTU,Actuate Therapeutics Inc. Common stock,NASDAQ,36367295.00,Health Care
ACU,Acme United Corporation. Common Stock,AMEX,181411192.00,Consumer Discretionary
ACV,Virtus Diversified Income & Convertible Fund Common Shares of Beneficial Interest,NYSE,290473601.00,Finance
ACVA,ACV Auctions Inc. Class A Common Stock,NYSE,1274469726.00,Consumer Discretionary
ACXP,Acurx Pharmaceuticals Inc. Common Stock,NASDAQ,6876381.00,Health Care
AD,Array Digital Infrastructure Inc. Common Shares,NYSE,3131136000.00,Telecommunications
ADAC,American Drive Acquisition Company Class A Ordinary Shares,NASDAQ,0.00,
ADACW,American Drive Acquisition Company Warrant,NASDAQ,0.00,
ADAG,Adagene Inc. American Depositary Shares,NASDAQ,295250625.00,Health Care
ADAM,Adamas Trust Inc. Common Stock,NASDAQ,821330527.00,Real Estate
ADAMG,Adamas Trust Inc. 9.125% Senior Notes Due 2030,NASDAQ,0.00,Real Estate
ADAMH,Adamas Trust Inc. 9.875% Senior Notes Due 2030,NASDAQ,0.00,Real Estate
ADAMI,Adamas Trust Inc. 9.125% Senior Notes Due 2029,NASDAQ,2268118461.00,Real Estate
ADAML,Adamas Trust Inc. 6.875% Series F Fixed-to-Floating Rate Cumulative Redeemable Preferred Stock $0.01 par value per share,NASDAQ,2183624924.00,Real Estate
ADAMM,Adamas Trust Inc. 7.875% Series E Fixed-to-Floating Rate Cumulative Redeemable Preferred Stock,NASDAQ,2229292339.00,Real Estate
ADAMN,Adamas Trust Inc. 8.00% Series D Fixed-to-Floating Rate Cumulative Redeemable Preferred Stock,NASDAQ,2144086037.00,Real Estate
ADAMO,Adamas Trust Inc. 9.250% Senior Notes Due 2031,NASDAQ,0.00,Real Estate
ADAMZ,Adamas Trust Inc. 7.000% Series G Cumulative Redeemable Preferred Stock $0.01 par value per share,NASDAQ,1683098553.00,Real Estate
ADBE,Adobe Inc. Common Stock,NASDAQ,87338700000.00,Technology
ADC,Agree Realty Corporation Common Stock,NYSE,9345203459.00,Real Estate
ADCT,ADC Therapeutics SA Common Shares,NYSE,151357478.00,Health Care
ADEA,Adeia Inc. Common Stock,NASDAQ,3219474533.00,Technology
ADGM,Adagio Medical Holdings Inc Common Stock,NASDAQ,14145841.00,Health Care
ADI,Analog Devices Inc. Common Stock,NASDAQ,183709748006.00,Technology
ADIL,Adial Pharmaceuticals Inc Common Stock,NASDAQ,6216501.00,Health Care
ADM,Archer-Daniels-Midland Company Common Stock,NYSE,37009441708.00,Consumer Staples
ADMA,ADMA Biologics Inc Common Stock,NASDAQ,2079302333.00,Health Care
ADNT,Adient plc Ordinary Shares ,NYSE,1471035140.00,Consumer Discretionary
ADP,Automatic Data Processing Inc. Common Stock,NASDAQ,97548650066.00,Industrials
ADPT,Adaptive Biotechnologies Corporation Common Stock,NASDAQ,3391340666.00,Health Care
ADSE,ADS-TEC ENERGY PLC Ordinary Shares,NASDAQ,896425535.00,Consumer Discretionary
ADSEW,ADS-TEC ENERGY PLC Warrant,NASDAQ,47002939.00,Consumer Discretionary
ADSK,Autodesk Inc. Common Stock,NASDAQ,43778280000.00,Technology
ADT,ADT Inc. Common Stock,NYSE,5393612158.00,Consumer Discretionary
ADTN,ADTRAN Holdings Inc. Common Stock,NASDAQ,1029485851.00,Utilities
ADUR,Aduro Clean Technologies Inc. Common Stock,NASDAQ,547253137.00,Industrials
ADUS,Addus HomeCare Corporation Common Stock,NASDAQ,1962974492.00,Health Care
ADV,Advantage Solutions Inc. Class A Common Stock,NASDAQ,516654581.00,Consumer Discretionary
ADVB,Advanced Biomed Inc. Common Stock,NASDAQ,8244144.00,Health Care
ADX,Adams Diversified Equity Fund Inc.,NYSE,0.00,Finance
ADXN,Addex Therapeutics Ltd American Depositary Shares,NASDAQ,9373240.00,Health Care
AEAQ,Activate Energy Acquisition Corp. Class A Ordinary Share,NASDAQ,0.00,
AEAQU,Activate Energy Acquisition Corp. Unit,NASDAQ,0.00,
AEAQW,Activate Energy Acquisition Corp. Warrant,NASDAQ,0.00,
AEBI,Aebi Schmidt Holding AG Common Stock ,NASDAQ,938176553.00,Industrials
AEC,Anfield Energy Inc. Common Shares,NASDAQ,76951599.00,Basic Materials
AEE,Ameren Corporation Common Stock,NYSE,31831970872.00,Utilities
AEF,abrdn Emerging Markets ex-China Fund Inc. Common Stock,AMEX,986661375.00,Finance
AEFC,Aegon Funding Company LLC 5.10% Subordinated Notes due 2049,NYSE,0.00,
AEG,Aegon Ltd. New York Registry Shares,NYSE,16531511417.00,Finance
AEHL,Antelope Enterprise Holdings Limited Class A Ordinary Shares,NASDAQ,18152445.00,Industrials
AEHR,Aehr Test Systems Common Stock,NASDAQ,2245999898.00,Industrials
AEI,Alset Inc. Common Stock (TX),NASDAQ,52120412.00,Finance
AEIS,Advanced Energy Industries Inc. Common Stock,NASDAQ,11837802604.00,Technology
AEM,Agnico Eagle Mines Limited Common Stock,NYSE,77005294314.00,Basic Materials
AEMD,Aethlon Medical Inc. Common Stock,NASDAQ,1683335.00,Health Care
AENT,Alliance Entertainment Holding Corporation Class A Common Stock,NASDAQ,303328799.00,Consumer Discretionary
AENTW,Alliance Entertainment Holding Corporation Warrant,NASDAQ,21946731.00,Consumer Discretionary
AEO,American Eagle Outfitters Inc. Common Stock,NYSE,2758257061.00,Consumer Discretionary
AEON,AEON Biopharma Inc. Class A Common Stock,AMEX,18812287.00,Health Care
AEP,American Electric Power Company Inc. Common Stock,NASDAQ,75363987982.00,Utilities
AER,AerCap Holdings N.V. Ordinary Shares,NYSE,26469826374.00,Consumer Discretionary
AERO,Grupo Aeromexico S.A.B. de C.V. American Depositary Shares (each representing ten (10) Common Shares),NYSE,2551850623.00,Consumer Discretionary
AERT,Aeries Technology Inc. Class A Ordinary Share,NASDAQ,42126822.00,Consumer Discretionary
AERTW,Aeries Technology Inc. Warrant,NASDAQ,122822.00,Consumer Discretionary
AES,The AES Corporation Common Stock,NYSE,10397839456.00,Utilities
AESI,Atlas Energy Solutions Inc. Common Stock,NYSE,1807383800.00,Industrials
AESP,Aeon Acquisition I Corp. Class A Ordinary Shares,NASDAQ,0.00,Finance
AESPR,Aeon Acquisition I Corp. Rights,NASDAQ,0.00,Finance
AESPU,Aeon Acquisition I Corp. Units,NASDAQ,0.00,
AESPW,Aeon Acquisition I Corp. Warrants,NASDAQ,0.00,Finance
AEVA,Aeva Technologies Inc. Common Stock,NASDAQ,1511718888.00,Consumer Discretionary
AEXA,American Exceptionalism Acquisition Corp. A Class A Ordinary Shares,NYSE,0.00,
AEYE,AudioEye Inc. Common Stock,NASDAQ,81332132.00,Technology
AFB,AllianceBernstein National Municipal Income Fund Inc,NYSE,0.00,Finance
AFBI,Affinity Bancshares Inc. Common Stock (MD),NASDAQ,137622503.00,Finance
AFCG,Advanced Flower Capital Inc. Common Stock,NASDAQ,73645282.00,Finance
AFG,American Financial Group Inc. Common Stock,NYSE,11860538348.00,Finance
AFGB,American Financial Group Inc. 5.875% Subordinated Debentures due 2059,NYSE,1694125232.00,Finance
AFGC,American Financial Group Inc. 5.125% Subordinated Debentures due 2059,NYSE,1488071747.00,Finance
AFGD,American Financial Group Inc. 5.625% Subordinated Debentures due 2060,NYSE,1626825505.00,Finance
AFGE,American Financial Group Inc. 4.500% Subordinated Debentures due 2060,NYSE,1329377328.00,Finance
AFJK,Aimei Health Technology Co. Ltd Ordinary Share,NASDAQ,0.00,
AFJKR,Aimei Health Technology Co. Ltd Right,NASDAQ,0.00,
AFJKU,Aimei Health Technology Co. Ltd Unit,NASDAQ,0.00,
AFL,AFLAC Incorporated Common Stock,NYSE,61526095196.00,Finance
AFRI,Forafric Global PLC Ordinary Shares,NASDAQ,275570189.00,Consumer Staples
AFRIW,Forafric Global PLC Warrants,NASDAQ,18888152.00,Consumer Staples
AFRM,Affirm Holdings Inc. Class A Common Stock,NASDAQ,28325720628.00,Finance
AFYA,Afya Limited Class A Common Shares,NASDAQ,1396481553.00,Real Estate
AG,First Majestic Silver Corp. Ordinary Shares (Canada),NYSE,8798973702.00,Basic Materials
AGBK,AGI Inc Class A Common Shares,NYSE,1137102798.00,Finance
AGCC,Agencia Comercial Spirits Ltd Class A Ordinary Shares,NASDAQ,551840200.00,Consumer Staples
AGCO,AGCO Corporation Common Stock,NYSE,8434869310.00,Industrials
AGD,abrdn Global Dynamic Dividend Fund Common Shares of Beneficial Interest,NYSE,0.00,Finance
AGEN,Agenus Inc. Common Stock,NASDAQ,145332084.00,Health Care
AGI,Alamos Gold Inc. Class A Common Shares,NYSE,13262507679.00,Basic Materials
AGIG,Abundia Global Impact Group Inc. Common stock,AMEX,41821680.00,Energy
AGIO,Agios Pharmaceuticals Inc. Common Stock,NASDAQ,2234943066.00,Health Care
AGL,agilon health inc. Common Stock,NYSE,1852067084.00,Health Care
AGM,Federal Agricultural Mortgage Corporation Common Stock,NYSE,2179997658.00,Finance
AGMB,AgomAb Therapeutics NV American Depositary Shares,NASDAQ,622986884.00,Health Care
AGMH,AGM Group Holdings Inc. Class A Ordinary Shares,NASDAQ,4338674.00,Technology
AGNC,AGNC Investment Corp. Common Stock,NASDAQ,12627221992.00,Real Estate
AGNCL,AGNC Investment Corp. Depositary Shares Each Representing a 1/1000th Interest in a Share of 7.75% Series G Fixed-Rate Reset Cumulative Redeemable Preferred Stock,NASDAQ,28525927616.00,Real Estate
AGNCM,AGNC Investment Corp. Depositary Shares rep 6.875% Series D Fixed-to-Floating Cumulative Redeemable Preferred Stock,NASDAQ,28411249482.00,Real Estate
AGNCN,AGNC Investment Corp. Depositary Shares Each Representing a 1/1000th Interest in a Share of 7.00% Series C Fixed-To-Floating Rate Cumulative Redeemable Preferred Stock,NASDAQ,29128705277.00,Real Estate
AGNCO,AGNC Investment Corp. Depositary Shares each representing a 1/1000th interest in a share of 6.50% Series E Fixed-to-Floating Cumulative Redeemable Preferred Stock,NASDAQ,28891083918.00,Real Estate
AGNCP,AGNC Investment Corp. Depositary Shares Each Representing a 1/1000th Interest in a Share of 6.125% Series F Fixed-to-Floating Rate Cumulative Redeemable Preferred Stock,NASDAQ,28422728775.00,Real Estate
AGNCZ,AGNC Investment Corp. Depositary Shares Each Representing a 1/1000th Interest in a Share of 8.75% Series H Fixed-Rate Cumulative Redeemable Preferred Stock,NASDAQ,28881900484.00,
AGNT,AGNT Inc. Common Stock,NASDAQ,874203276.00,Finance
AGO,Assured Guaranty Ltd. Common Stock,NYSE,3705113763.00,Finance
AGPU,Axe Compute Inc. Common Stock,NASDAQ,76599186.00,Health Care
AGRO,Adecoagro S.A. Common Shares,NYSE,1391133612.00,Consumer Staples
AGRZ,Agroz Inc. Ordinary Shares,NASDAQ,8140801.00,Consumer Staples
AGX,Argan Inc. Common Stock,NYSE,9899691269.00,Consumer Discretionary
AGYS,Agilysys Inc. Common Stock (DE),NASDAQ,3121144159.00,Technology
AHCO,AdaptHealth Corp. Common Stock,NASDAQ,1463942676.00,Health Care
AHG,Akso Health Group ADS,NASDAQ,838828989.00,Consumer Discretionary
AHMA,Ambitions Enterprise Management Co. L.L.C Class A Ordinary Shares,NASDAQ,73420750.00,Consumer Discretionary
AHR,American Healthcare REIT Inc. Common Stock,NYSE,10607435832.00,Real Estate
AHRT,AH Realty Trust Inc. Common Stock,NYSE,540042866.00,Finance
AHT,Ashford Hospitality Trust Inc Common Stock,NYSE,20530476.00,Real Estate
AI,C3.ai Inc. Class A Common Stock,NYSE,1408370450.00,Technology
AIAI,AIAI Holdings Corporation Class A Common Stock,NASDAQ,994942959.00,Technology
AIB,AIB Data Centers Inc. Common Stock,AMEX,71151191.00,Finance
AIBZ,Bitzero Holdings Inc. Common Shares,NASDAQ,390622363.00,
AIDX,20/20 Biolabs Inc. Common Stock,NASDAQ,7534487.00,Health Care
AIFA,All In FutureTech Alliance Inc. Common Stock,NASDAQ,14285647.00,Consumer Discretionary
AIFC,AI Financial Corporation Common Stock,NASDAQ,84069710.00,Finance
AIFF,Firefly Neuroscience Inc. Common Stock,NASDAQ,20131509.00,Technology
AIFU,AIFU Inc. Class A Ordinary Share,NASDAQ,260306008.00,Finance
AIG,American International Group Inc. New Common Stock,NYSE,42093071885.00,Finance
AIHS,Senmiao Technology Limited Common Stock,NASDAQ,19798185.00,Finance
AII,American Integrity Insurance Group Inc. Common Stock,NYSE,377515044.00,Finance
AIIA,AI Infrastructure Acquisition Corp. Class A Ordinary Shares,NYSE,0.00,Finance
AIIO,Robo.ai Inc. Class B Ordinary Shares,NASDAQ,581374198.00,Industrials
AIIOW,Robo.ai Inc. Warrant,NASDAQ,5479138.00,Industrials
AIIR,Air Global PLC Ordinary Shares,NASDAQ,1076194099.00,Consumer Discretionary
AIM,AIM ImmunoTech Inc. Common Stock,AMEX,7762789.00,Health Care
AIMD,Ainos Inc. Common Stock,NASDAQ,15940894.00,Technology
AIMDW,Ainos Inc. Warrants,NASDAQ,1262485.00,Technology
AIN,Albany International Corporation Common Stock,NYSE,2084276000.00,Consumer Discretionary
AIO,Virtus Artificial Intelligence & Technology Opportunities Fund Common Shares of Beneficial Interest,NYSE,928579883.00,Finance
AIOS,AIOS Tech Inc. Class A Common Shares,NASDAQ,44384823.00,Industrials
AIOT,PowerFleet Inc. Common Stock,NASDAQ,586370437.00,Telecommunications
AIP,Arteris Inc. Common Stock,NASDAQ,1618789689.00,Technology
AIR,AAR Corp. Common Stock,NYSE,5571371589.00,Industrials
AIRE,reAlpha Tech Corp. Common Stock,NASDAQ,10085734.00,Finance
AIRG,Airgain Inc. Common Stock,NASDAQ,78463078.00,Technology
AIRI,Air Industries Group Common Stock,AMEX,14454961.00,Industrials
AIRJ,AirJoule Technologies Corporation Class A Common Stock,NASDAQ,350056843.00,Industrials
AIRJW,AirJoule Technologies Corporation Warrant,NASDAQ,78192635.00,Industrials
AIRO,AIRO Group Holdings Inc. Common Stock,NASDAQ,238986894.00,Industrials
AIRS,AirSculpt Technologies Inc. Common Stock,NASDAQ,318866478.00,Health Care
AIRT,Air T Inc. Common Stock,NASDAQ,77848215.00,Consumer Discretionary
AIRTP,Air T Inc. Air T Funding Alpha Income Trust Preferred Securities,NASDAQ,52716751.00,Consumer Discretionary
AISP,Airship AI Holdings Inc. Class A Common Stock,NASDAQ,77083023.00,Technology
AISPW,Airship AI Holdings Inc. Warrants,NASDAQ,24088445.00,Technology
AIT,Applied Industrial Technologies Inc. Common Stock,NYSE,12228064140.00,Consumer Discretionary
AIV,Apartment Investment and Management Company Common Stock,NYSE,425814302.00,Real Estate
AIXC,AIxCrypto Holdings Inc. Common Stock,NASDAQ,22258492.00,Health Care
AIXI,XIAO-I Corporation American Depositary Shares,NASDAQ,5173435.00,Technology
AIZ,Assurant Inc. Common Stock,NYSE,13847573589.00,Finance
AIZN,Assurant Inc. 5.25% Subordinated Notes due 2061,NYSE,947876279.00,Finance
AJG,Arthur J. Gallagher & Co. Common Stock,NYSE,64851836000.00,Finance
AKA,a.k.a. Brands Holding Corp. Common Stock,NYSE,121207430.00,Consumer Discretionary
AKAM,Akamai Technologies Inc. Common Stock,NASDAQ,16453271490.00,Consumer Discretionary
AKAN,Akanda Corp. Common Shares,NASDAQ,6668570.00,Health Care
AKBA,Akebia Therapeutics Inc. Common Stock,NASDAQ,332640221.00,Health Care
AKR,Acadia Realty Trust Common Stock,NYSE,2839909589.00,Real Estate
AKTS,Aktis Oncology Inc. Common stock,NASDAQ,1755611717.00,Health Care
AKTX,Akari Therapeutics plc ADS,NASDAQ,18221206.00,Health Care
ALAB,Astera Labs Inc. Common Stock,NASDAQ,69663614568.00,Technology
ALAR,Alarum Technologies Ltd. American Depositary Share,NASDAQ,46040491.00,Technology
ALB,Albemarle Corporation Common Stock,NYSE,15987221290.00,Industrials
ALBT,Avalon GloboCare Corp. Common Stock,NASDAQ,3397438.00,Health Care
ALC,Alcon Inc. Ordinary Shares,NYSE,34809102000.00,Health Care
ALCO,Alico Inc. Common Stock,NASDAQ,310002469.00,
ALDF,Aldel Financial II Inc. Class A Ordinary Shares,NASDAQ,0.00,
ALDFU,Aldel Financial II Inc. Units,NASDAQ,0.00,Finance
ALDFW,Aldel Financial II Inc. Warrants,NASDAQ,0.00,Finance
ALDX,Aldeyra Therapeutics Inc. Common Stock,NASDAQ,136928824.00,Health Care
ALEC,Alector Inc. Common Stock,NASDAQ,228711885.00,Health Care
ALF,Centurion Acquisition Corp. Class A Ordinary Shares,NASDAQ,0.00,
ALFUW,Centurion Acquisition Corp. Warrant,NASDAQ,0.00,Finance
ALG,Alamo Group Inc. Common Stock,NYSE,2071660396.00,Industrials
ALGM,Allegro MicroSystems Inc. Common Stock,NASDAQ,10337358416.00,Technology
ALGN,Align Technology Inc. Common Stock,NASDAQ,13214976794.00,Health Care
ALGS,Aligos Therapeutics Inc. Common Stock,NASDAQ,34592167.00,Health Care
ALGT,Allegiant Travel Company Common Stock,NASDAQ,2187953204.00,Consumer Discretionary
ALH,Alliance Laundry Holdings Inc. Common Stock,NYSE,5136019741.00,Industrials
ALHC,Alignment Healthcare Inc. Common Stock,NASDAQ,4920264987.00,Health Care
ALIS,Calisa Acquisition Corp Ordinary shares,NASDAQ,0.00,
ALISR,Calisa Acquisition Corp Right,NASDAQ,0.00,Finance
ALISU,Calisa Acquisition Corp Units,NASDAQ,0.00,
ALIT,Alight Inc. Class A Common Stock,NYSE,383053532.00,Consumer Discretionary
ALK,Alaska Air Group Inc. Common Stock,NYSE,5692906486.00,Consumer Discretionary
ALKS,Alkermes plc Ordinary Shares,NASDAQ,9097165546.00,Health Care
ALKT,Alkami Technology Inc. Common Stock,NASDAQ,2035504689.00,Technology
ALL,Allstate Corporation (The) Common Stock,NYSE,64440181407.00,Finance
ALLE,Allegion plc Ordinary Shares,NYSE,12080863339.00,Consumer Discretionary
ALLO,Allogene Therapeutics Inc. Common Stock,NASDAQ,717921487.00,Health Care
ALLR,Allarity Therapeutics Inc. Common Stock,NASDAQ,20253548.00,Health Care
ALLT,Allot Ltd. Ordinary Shares,NASDAQ,412421725.00,Telecommunications
ALLY,Ally Financial Inc. Common Stock,NYSE,13891625170.00,Finance
ALM,Almonty Industries Inc. Common Shares,NASDAQ,4457584448.00,Basic Materials
ALMR,Alamar Biosciences Inc. Common Stock,NASDAQ,1797932165.00,Industrials
ALMS,Alumis Inc. Common Stock,NASDAQ,3378537470.00,Health Care
ALMU,Aeluma Inc. Common Stock,NASDAQ,345055565.00,Technology
ALNT,Allient Inc. Common Stock,NASDAQ,1476826928.00,Industrials
ALNY,Alnylam Pharmaceuticals Inc. Common Stock,NASDAQ,41760062583.00,Health Care
ALOT,AstroNova Inc. Common Stock,NASDAQ,220888980.00,Technology
ALOV,Aldabra 4 Liquidity Opportunity Vehicle Inc. Class A Ordinary Shares,NASDAQ,0.00,
ALOVU,Aldabra 4 Liquidity Opportunity Vehicle Inc. Units,NASDAQ,0.00,Finance
ALOVW,Aldabra 4 Liquidity Opportunity Vehicle Inc. Warrants,NASDAQ,0.00,
ALOY,REalloys Inc. Common Stock,NASDAQ,913426036.00,Technology
ALP,Alpha Compute Corp Common Stock,NASDAQ,5811778.00,Energy
ALPS,ALPS Group Inc Ordinary Share,NASDAQ,98009792.00,
ALPXU,Alpex Acquisition Corporation Unit,NASDAQ,0.00,Finance
ALRM,Alarm.com Holdings Inc. Common Stock,NASDAQ,2457696369.00,Technology
ALRS,Alerus Financial Corporation Common Stock,NASDAQ,781752177.00,Finance
ALSN,Allison Transmission Holdings Inc. Common Stock,NYSE,9651260109.00,Consumer Discretionary
ALT,Altimmune Inc. Common Stock,NASDAQ,614538327.00,Health Care
ALTG,Alta Equipment Group Inc. Class A Common Stock,NYSE,201394993.00,Industrials
ALTI,AlTi Global Inc. Class A Common Stock,NASDAQ,560986008.00,Finance
ALTO,Alto Ingredients Inc. Common Stock,NASDAQ,430817451.00,Industrials
ALUB,Alussa Energy Acquisition Corp. II Class A Ordinary Shares,NYSE,0.00,
ALV,Autoliv Inc. Common Stock,NYSE,8702114409.00,Consumer Discretionary
ALVO,Alvotech Ordinary Shares,NASDAQ,1126872922.00,Health Care
ALVOW,Alvotech Warrant,NASDAQ,53097253.00,Health Care
ALX,Alexander's Inc. Common Stock,NYSE,1404504750.00,Real Estate
ALXO,ALX Oncology Holdings Inc. Common Stock,NASDAQ,278545238.00,Health Care
ALZN,Alzamend Neuro Inc. Common Stock,NASDAQ,4413500.00,Health Care
AM,Antero Midstream Corporation Common Stock,NYSE,10668050800.00,Utilities
